"stringdb:9606.ENSP00000359345",,"1.498801","4.767022","4.24286","0.528752","4.278115",,"0.769865","2.308422","5.0",,"1.243826","RPL5",,"9606.ENSP00000359345","9606.ENSP00000359345","false","9606.ENSP00000359345",,"P46777","9606.ENSP00000359345","Large ribosomal subunit protein uL18; Component of the ribosome, a large ribonucleoprotein complex responsible for the synthesis of proteins in the cell. The small ribosomal subunit (SSU) binds messenger RNAs (mRNAs) and translates the encoded message by selecting cognate aminoacyl- transfer RNA (tRNA) molecules. The large subunit (LSU) contains the ribosomal catalytic site termed the peptidyl transferase center (PTC), which catalyzes the formation of peptide bonds, thereby polymerizing the amino acids delivered by tRNAs into a polypeptide chain. The nascent polypeptides leave the ribosome through a tunnel in the LSU and interact with protein factors that function in enzymatic processing, targeting, and the membrane insertion of nascent chains at the exit of the ribosomal tunnel. As part of the 5S RNP/5S ribonucleoprotein particle it is an essential component of the LSU, required for its formation and the maturation of rRNAs. It also couples ribosome biogenesis to p53/TP53 activation. As part of the 5S RNP it accumulates in the nucleoplasm and inhibits MDM2, when ribosome biogenesis is perturbed, mediating the stabilization and the activation of TP53.","label: attribute=""display name"" labelsize=12 labelAlignment=left outline=true outlineColor=white outlineTransparency=95 outlineWidth=10 background=false color=black dropShadow=false","","stringdb","protein","MGFVKVVKNKAYFKRYQVKFRRRREGKTDYYARKRLVIQDKNKYNTPKYRMIVRVTNRDIICQIAYARIEGDMIVCAAYAHELPKYGVKVGLTNYAAAYCTGLLLARRLLNRFGMDKIYEGQVEVTGDEYNVESIDGQPGAFTCYLDAGLARTTTGNKVFGALKGAVDGGLSIPHSTKRFPGYDSESKEFNAEVHRKHIMGQNVADYMRYLMEEDEDAYKKQFSQYIKNSVTPDMMEEMYKKAHAAIRENPVYEKKPKKEVKKKRWNRPKMSLAQKKDRVAQKKASFLRAQERAAES","Homo sapiens","","Tbio","","2.457882","4.850648","4.197378","3.279022","4.575079","2.33136","4.652675","4.896142","4.478397","4.951807","4.940389","4.238262","4.906529","4.735309","2.787107","4.458259","3.084385","4.328246","2.824901","2.481156"
"stringdb:9606.ENSP00000464342",,"1.193418","5.0","1.044601",,"0.856522","0.616226","0.526981","2.300621","4.512378",,"0.782628","RPL36",,"9606.ENSP00000464342","9606.ENSP00000464342","false","9606.ENSP00000464342",,"Q9Y3U8","9606.ENSP00000464342","Large ribosomal subunit protein eL36; Component of the large ribosomal subunit.","label: attribute=""display name"" labelsize=12 labelAlignment=left outline=true outlineColor=white outlineTransparency=95 outlineWidth=10 background=false color=black dropShadow=false","","stringdb","protein","MALRYPMAVGLNKGHKVTKNVSKPRHSRRRGRLTKHTKFVRDMIREVCGFAPYERRAMELLKVSKDKRALKFIKKRVGTHIRAKRKREELSNVLAAMRKAAAKKD","Homo sapiens","","Tbio","","2.55453","4.429446",,"2.833901","0.820305","2.222716","2.498301","2.823249","4.545636","3.763174","2.228229","2.790137","4.0584","2.729408","2.62545","4.603001","2.507586","2.414639","2.142389","2.335257"
"stringdb:9606.ENSP00000359424",,"2.354608","4.834928","2.076501","2.107937","2.584465","1.458042","2.050844","2.40094","4.815756","1.65523","4.014025","CHUK",,"9606.ENSP00000359424","9606.ENSP00000359424","false","9606.ENSP00000359424",,"O15111","9606.ENSP00000359424","Inhibitor of nuclear factor kappa-B kinase subunit alpha; Serine kinase that plays an essential role in the NF- kappa-B signaling pathway which is activated by multiple stimuli such as inflammatory cytokines, bacterial or viral products, DNA damages or other cellular stresses. Acts as part of the canonical IKK complex in the conventional pathway of NF-kappa-B activation and phosphorylates inhibitors of NF-kappa-B on serine residues. These modifications allow polyubiquitination of the inhibitors and subsequent degradation by the proteasome. In turn, free NF-kappa-B is translocated into the nucleus and activates the transcription of hundreds of genes involved in immune response, growth control, or protection against apoptosis. Negatively regulates the pathway by phosphorylating the scaffold protein TAXBP1 and thus promoting the assembly of the A20/TNFAIP3 ubiquitin-editing complex (composed of A20/TNFAIP3, TAX1BP1, and the E3 ligases ITCH and RNF11). Therefore, CHUK plays a key role in the negative feedback of NF-kappa-B canonical signaling to limit inflammatory gene activation. As part of the non-canonical pathway of NF-kappa-B activation, the MAP3K14-activated CHUK/IKKA homodimer phosphorylates NFKB2/p100 associated with RelB, inducing its proteolytic processing to NFKB2/p52 and the formation of NF-kappa- B RelB-p52 complexes. In turn, these complexes regulate genes encoding molecules involved in B-cell survival and lymphoid organogenesis. Participates also in the negative feedback of the non-canonical NF-kappa-B signaling pathway by phosphorylating and destabilizing MAP3K14/NIK. Within the nucleus, phosphorylates CREBBP and consequently increases both its transcriptional and histone acetyltransferase activities. Modulates chromatin accessibility at NF-kappa-B-responsive promoters by phosphorylating histones H3 at 'Ser-10' that are subsequently acetylated at 'Lys-14' by CREBBP. Additionally, phosphorylates the CREBBP-interacting protein NCOA3. Also phosphorylates FOXO3 and may regulate this pro-apoptotic transcription factor.","label: attribute=""display name"" labelsize=12 labelAlignment=left outline=true outlineColor=white outlineTransparency=95 outlineWidth=10 background=false color=black dropShadow=false","","stringdb","protein","MERPPGLRPGAGGPWEMRERLGTGGFGNVCLYQHRELDLKIAIKSCRLELSTKNRERWCHEIQIMKKLNHANVVKACDVPEELNILIHDVPLLAMEYCSGGDLRKLLNKPENCCGLKESQILSLLSDIGSGIRYLHENKIIHRDLKPENIVLQDVGGKIIHKIIDLGYAKDVDQGSLCTSFVGTLQYLAPELFENKPYTATVDYWSFGTMVFECIAGYRPFLHHLQPFTWHEKIKKKDPKCIFACEEMSGEVRFSSHLPQPNSLCSLVVEPMENWLQLMLNWDPQQRGGPVDLTLKQPRCFVLMDHILNLKIVHILNMTSAKIISFLLPPDESLHSLQSRIERETGINTGSQELLSETGISLDPRKPASQCVLDGVRGCDSYMVYLFDKSKTVYEGPFASRSLSDCVNYIVQDSKIQLPIIQLRKVWAEAVHYVSGLKEDYSRLFQGQRAAMLSLLRYNANLTKMKNTLISASQQLKAKLEFFHKSIQLDLERYSEQMTYGISSEKMLKAWKEMEEKAIHYAEVGVIGYLEDQIMSLHAEIMELQKSPYGRRQGDLMESLEQRAIDLYKQLKHRPSDHSYSDSTEMVKIIVHTVQSQDRVLKELFGHLSKLLGCKQKIIDLLPKVEVALSNIKEADNTVMFMQGKRQKEIWHLLKIACTQSSARSLVGSSLEGAVTPQTSAWLPPTSAEHDHSLSCVVTPQDGETSAQMIEENLNCLGHLSTIIHEANEEQGNSMMNLDWSWLTE","Homo sapiens","3BRT|5EBZ|5TQW|5TQX|5TQY","Tchem","Kinase","1.855982","4.574197","1.941558","2.626676","1.823992","0.869232","4.528841","2.870713","2.81569","2.901152","2.604056","2.477627","2.78624","2.084867","1.575509","2.509753","2.868078","2.225264","1.968203","1.061111"
"stringdb:9606.ENSP00000223642",,"1.693784","1.909932","2.473633","1.10878","5.0",,"1.437285","1.230419","1.695879","0.375","5.0","C5",,"9606.ENSP00000223642","9606.ENSP00000223642","false","9606.ENSP00000223642",,"P01031","9606.ENSP00000223642","C3 and PZP-like alpha-2-macroglobulin domain-containing protein 4; Activation of C5 by a C5 convertase initiates the spontaneous assembly of the late complement components, C5-C9, into the membrane attack complex. C5b has a transient binding site for C6. The C5b-C6 complex is the foundation upon which the lytic complex is assembled; C3 and PZP like, alpha-2-macroglobulin domain containing","label: attribute=""display name"" labelsize=12 labelAlignment=left outline=true outlineColor=white outlineTransparency=95 outlineWidth=10 background=false color=black dropShadow=false","","stringdb","protein","MGLLGILCFLIFLGKTWGQEQTYVISAPKIFRVGASENIVIQVYGYTEAFDATISIKSYPDKKFSYSSGHVHLSSENKFQNSAILTIQPKQLPGGQNPVSYVYLEVVSKHFSKSKRMPITYDNGFLFIHTDKPVYTPDQSVKVRVYSLNDDLKPAKRETVLTFIDPEGSEVDMVEEIDHIGIISFPDFKIPSNPRYGMWTIKAKYKEDFSTTGTAYFEVKEYVLPHFSVSIEPEYNFIGYKNFKNFEITIKARYFYNKVVTEADVYITFGIREDLKDDQKEMMQTAMQNTMLINGIAQVTFDSETAVKELSYYSLEDLNNKYLYIAVTVIESTGGFSEEAEIPGIKYVLSPYKLNLVATPLFLKPGIPYPIKVQVKDSLDQLVGGVPVTLNAQTIDVNQETSDLDPSKSVTRVDDGVASFVLNLPSGVTVLEFNVKTDAPDLPEENQAREGYRAIAYSSLSQSYLYIDWTDNHKALLVGEHLNIIVTPKSPYIDKITHYNYLILSKGKIIHFGTREKFSDASYQSINIPVTQNMVPSSRLLVYYIVTGEQTAELVSDSVWLNIEEKCGNQLQVHLSPDADAYSPGQTVSLNMATGMDSWVALAAVDSAVYGVQRGAKKPLERVFQFLEKSDLGCGAGGGLNNANVFHLAGLTFLTNANADDSQENDEPCKEILRPRRTLQKKIEEIAAKYKHSVVKKCCYDGACVNNDETCEQRAARISLGPRCIKAFTECCVVASQLRANISHKDMQLGRLHMKTLLPVSKPEIRSYFPESWLWEVHLVPRRKQLQFALPDSLTTWEIQGVGISNTGICVADTVKAKVFKDVFLEMNIPYSVVRGEQIQLKGTVYNYRTSGMQFCVKMSAVEGICTSESPVIDHQGTKSSKCVRQKVEGSSSHLVTFTVLPLEIGLHNINFSLETWFGKEILVKTLRVVPEGVKRESYSGVTLDPRGIYGTISRRKEFPYRIPLDLVPKTEIKRILSVKGLLVGEILSAVLSQEGINILTHLPKGSAEAELMSVVPVFYVFHYLETGNHWNIFHSDPLIEKQKLKKKLKEGMLSIMSYRNADYSYSVWKGGSASTWLTAFALRVLGQVNKYVEQNQNSICNSLLWLVENYQLDNGSFKENSQYQPIKLQGTLPVEARENSLYLTAFTVIGIRKAFDICPLVKIDTALIKADNFLLENTLPAQSTFTLAISAYALSLGDKTHPQFRSIVSALKREALVKGNPPIYRFWKDNLQHKDSSVPNTGTARMVETTAYALLTSLNLKDINYVNPVIKWLSEEQRYGGGFYSTQDTINAIEGLTEYSLLVKQLRLSMDIDVSYKHKGALHNYKMTDKNFLGRPVEVLLNDDLIVSTGFGSGLATVHVTTVVHKTSTSEEVCSFYLKIDTQDIEASHYRGYGNSDYKRIVACASYKPSREESSSGSSHAVMDISLPTGISANEEDLKALVEGVDQLFTDYQIKDGHVILQLNSIPSSDFLCVRFRIFELFEVGFLSPATFTVYEYHRPDKQCTMFYSTSNIKIQKVCEGAACKCVEADCGQMQEELDLTISAETRKQTACKPEIAYAYKVSITSITVENVFVKYKATLLDIYKTGEAVAEKDSEITFIKKVTCTNAELVKGRQYLIMGKEALQIKYNFSFRYIYPLDSLTWIEYWPRDTTCSSCQAFLANLDEFAEDIFLNGC","Homo sapiens","1CFA|1KJS|1XWE|3CU7|3HQA|3HQB|3KLS|3KM9|3PRX|3PVM|4A5W|4E0S|4P39|4UU9|5B4P|5B71|5HCC|5HCD|5HCE|5I5K|6H03|6H04","Tclin","","2.366667","2.515441","1.019082","4.286088","1.692544","2.466667","2.610679","2.926395","3.077207","3.917756","1.779411","1.577487","1.981926","1.637284","1.349206","1.525148","1.92692","0.545455","0.769758","2.4"
"stringdb:9606.ENSP00000418868",,"1.481296","4.423987","1.206146","0.561564","1.305578","0.649942",,"1.433947","2.976286",,"1.07026","RPL29",,"9606.ENSP00000418868","9606.ENSP00000418868","false","9606.ENSP00000418868",,"P47914","9606.ENSP00000418868","Cell surface heparin-binding protein HIP; Component of the large ribosomal subunit.","label: attribute=""display name"" labelsize=12 labelAlignment=left outline=true outlineColor=white outlineTransparency=95 outlineWidth=10 background=false color=black dropShadow=false","","stringdb","protein","MAKSKNHTTHNQSRKWHRNGIKKPRSQRYESLKGVDPKFLRNMRFAKKHNKKGLKKMQANNAKAMSARAEAIKALVKPKEVKPKIPKGVSRKLDRLAYIAHPKLGKRARARIAKGLRLCRPKAKAKAKAKDQTKAQAAAPASVPAQAPKRTQAPTKASE","Homo sapiens","","Tbio","","2.349342","4.527276","3.514696","2.958801","3.755093","2.292256","3.131372","3.832992","3.145008","4.660015","4.572669","3.800326","4.883116","4.707738","2.4485","3.425231","2.815937","3.369499","2.273541","2.421055"
"stringdb:9606.ENSP00000222254",,"1.874357","4.725882","1.502981","1.462377","1.891453","1.035266","1.263275","1.5262","4.585719","0.806313","2.220084","PIK3R2",,"9606.ENSP00000222254","9606.ENSP00000222254","false","9606.ENSP00000222254",,"O00459","9606.ENSP00000222254","Phosphatidylinositol 3-kinase 85 kDa regulatory subunit beta; Regulatory subunit of phosphoinositide-3-kinase (PI3K), a kinase that phosphorylates PtdIns(4,5)P2 (Phosphatidylinositol 4,5-bisphosphate) to generate phosphatidylinositol 3,4,5- trisphosphate (PIP3). PIP3 plays a key role by recruiting PH domain-containing proteins to the membrane, including AKT1 and PDPK1, activating signaling cascades involved in cell growth, survival, proliferation, motility and morphology. Binds to activated (phosphorylated) protein-tyrosine kinases, through its SH2 domain, and acts as an adapter, mediating the association of the p110 catalytic unit to the plasma membrane. Indirectly regulates autophagy. Promotes nuclear translocation of XBP1 isoform 2 in a ER stress- and/or insulin- dependent manner during metabolic overloading in the liver and hence plays a role in glucose tolerance improvement (By similarity).","label: attribute=""display name"" labelsize=12 labelAlignment=left outline=true outlineColor=white outlineTransparency=95 outlineWidth=10 background=false color=black dropShadow=false","","stringdb","protein","MAGPEGFQYRALYPFRRERPEDLELLPGDVLVVSRAALQALGVAEGGERCPQSVGWMPGLNERTRQRGDFPGTYVEFLGPVALARPGPRPRGPRPLPARPRDGAPEPGLTLPDLPEQFSPPDVAPPLLVKLVEAIERTGLDSESHYRPELPAPRTDWSLSDVDQWDTAALADGIKSFLLALPAPLVTPEASAEARRALREAAGPVGPALEPPTLPLHRALTLRFLLQHLGRVASRAPALGPAVRALGATFGPLLLRAPPPPSSPPPGGAPDGSEPSPDFPALLVEKLLQEHLEEQEVAPPALPPKPPKAKPASTVLANGGSPPSLQDAEWYWGDISREEVNEKLRDTPDGTFLVRDASSKIQGEYTLTLRKGGNNKLIKVFHRDGHYGFSEPLTFCSVVDLINHYRHESLAQYNAKLDTRLLYPVSKYQQDQIVKEDSVEAVGAQLKVYHQQYQDKSREYDQLYEEYTRTSQELQMKRTAIEAFNETIKIFEEQGQTQEKCSKEYLERFRREGNEKEMQRILLNSERLKSRIAEIHESRTKLEQQLRAQASDNREIDKRMNSLKPDLMQLRKIRDQYLVWLTQKGARQKKINEWLGIKNETEDQYALMEDEDDLPHHEERTWYVGKINRTQAEEMLSGKRDGTFLIRESSQRGCYACSVVVDGDTKHCVIYRTATGFGFAEPYNLYGSLKELVLHYQHASLVQHNDALTVTLAHPVRAPGPGPPPAAR","Homo sapiens","2KT1|2XS6|3MTT|3O5Z","Tbio","Enzyme","1.679653","2.522931","1.198156","1.911401","1.605705","0.957448","2.354475","2.533251","2.631889","2.388942","1.865054","2.658575","4.856169","2.265901","1.322062","2.272671","1.809082","1.556683","1.832553","0.982271"
"stringdb:9606.ENSP00000315768",,"1.965245","4.75159","1.870583","2.137444","2.411856","1.426943","1.786887","2.033734","4.708397","1.156949","4.62391","STAT2",,"9606.ENSP00000315768","9606.ENSP00000315768","false","9606.ENSP00000315768",,"P52630","9606.ENSP00000315768","Signal transducer and activator of transcription 2, 113kDa; Signal transducer and activator of transcription that mediates signaling by type I IFNs (IFN-alpha and IFN-beta). Following type I IFN binding to cell surface receptors, Jak kinases (TYK2 and JAK1) are activated, leading to tyrosine phosphorylation of STAT1 and STAT2. The phosphorylated STATs dimerize, associate with IRF9/ISGF3G to form a complex termed ISGF3 transcription factor, that enters the nucleus. ISGF3 binds to the IFN stimulated response element (ISRE) to activate the transcription of interferon stimulated genes, which drive the cell in an antiviral state. Acts as a regulator of mitochondrial fission by modulating the phosphorylation of DNM1L at 'Ser-616' and 'Ser-637' which activate and inactivate the GTPase activity of DNM1L respectively; SH2 domain containing","label: attribute=""display name"" labelsize=12 labelAlignment=left outline=true outlineColor=white outlineTransparency=95 outlineWidth=10 background=false color=black dropShadow=false","","stringdb","protein","MAQWEMLQNLDSPFQDQLHQLYSHSLLPVDIRQYLAVWIEDQNWQEAALGSDDSKATMLFFHFLDQLNYECGRCSQDPESLLLQHNLRKFCRDIQPFSQDPTQLAEMIFNLLLEEKRILIQAQRAQLEQGEPVLETPVESQQHEIESRILDLRAMMEKLVKSISQLKDQQDVFCFRYKIQAKGKTPSLDPHQTKEQKILQETLNELDKRRKEVLDASKALLGRLTTLIELLLPKLEEWKAQQQKACIRAPIDHGLEQLETWFTAGAKLLFHLRQLLKELKGLSCLVSYQDDPLTKGVDLRNAQVTELLQRLLHRAFVVETQPCMPQTPHRPLILKTGSKFTVRTRLLVRLQEGNESLTVEVSIDRNPPQLQGFRKFNILTSNQKTLTPEKGQSQGLIWDFGYLTLVEQRSGGSGKGSNKGPLGVTEELHIISFTVKYTYQGLKQELKTDTLPVVIISNMNQLSIAWASVLWFNLLSPNLQNQQFFSNPPKAPWSLLGPALSWQFSSYVGRGLNSDQLSMLRNKLFGQNCRTEDPLLSWADFTKRESPPGKLPFWTWLDKILELVHDHLKDLWNDGRIMGFVSRSQERRLLKKTMSGTFLLRFSESSEGGITCSWVEHQDDDKVLIYSVQPYTKEVLQSLPLTEIIRHYQLLTEENIPENPLRFLYPRIPRDEAFGCYYQEKVNLQERRKYLKHRLIVVSNRQVDELQQPLELKPEPELESLELELGLVPEPELSLDLEPLLKAGLDLGPELESVLESTLEPVIEPTLCMVSQTVPEPDQGPVSQPVPEPDLPCDLRHLNTEPMEIFRNCVKIEEIMPNGDPLLAGQNTVDEVYVSRPSHFYTDGPLMPSDF","Homo sapiens","2KA4","Tbio","TF","2.141692","2.733093","1.423588","2.736105","1.591772","1.838009","2.638424","2.961878","2.858355","4.650188","4.659201","2.505442","4.431806","2.076357","2.416301","2.831827","3.345395","2.338098","2.232527","1.834209"
"stringdb:9606.ENSP00000333657",,"3.685078","4.664739","1.577066","1.735082","1.920479","1.091788","1.410248","3.80808","5.0","0.943656","3.740945","MX2",,"9606.ENSP00000333657","9606.ENSP00000333657","false","9606.ENSP00000333657",,"P20592","9606.ENSP00000333657","Interferon-regulated resistance GTP-binding protein MxB; Interferon-induced dynamin-like GTPase with potent antiviral activity against human immunodeficiency virus type 1 (HIV-1). Acts by targeting the viral capsid and affects the nuclear uptake and/or stability of the HIV-1 replication complex and the subsequent chromosomal integration of the proviral DNA. Exhibits antiviral activity also against simian immunodeficiency virus (SIV-mnd). May play a role in regulating nucleocytoplasmic transport and cell-cycle progression.","label: attribute=""display name"" labelsize=12 labelAlignment=left outline=true outlineColor=white outlineTransparency=95 outlineWidth=10 background=false color=black dropShadow=false","","stringdb","protein","MSKAHKPWPYRRRSQFSSRKYLKKEMNSFQQQPPPFGTVPPQMMFPPNWQGAEKDAAFLAKDFNFLTLNNQPPPGNRSQPRAMGPENNLYSQYEQKVRPCIDLIDSLRALGVEQDLALPAIAVIGDQSSGKSSVLEALSGVALPRGSGIVTRCPLVLKLKKQPCEAWAGRISYRNTELELQDPGQVEKEIHKAQNVMAGNGRGISHELISLEITSPEVPDLTIIDLPGITRVAVDNQPRDIGLQIKALIKKYIQRQQTINLVVVPCNVDIATTEALSMAHEVDPEGDRTIGILTKPDLMDRGTEKSVMNVVRNLTYPLKKGYMIVKCRGQQEITNRLSLAEATKKEITFFQTHPYFRVLLEEGSATVPRLAERLTTELIMHIQKSLPLLEGQIRESHQKATEELRRCGADIPSQEADKMFFLIEKIKMFNQDIEKLVEGEEVVRENETRLYNKIREDFKNWVGILATNTQKVKNIIHEEVEKYEKQYRGKELLGFVNYKTFEIIVHQYIQQLVEPALSMLQKAMEIIQQAFINVAKKHFGEFFNLNQTVQSTIEDIKVKHTAKAENMIQLQFRMEQMVFCQDQIYSVVLKKVREEIFNPLGTPSQNMKLNSHFPSNESSVSSFTEIGIHLNAYFLETSKRLANQIPFIIQYFMLRENGDSLQKAMMQILQEKNRYSWLLQEQSETATKRRILKERIYRLTQARHALCQFSSKEIH","Homo sapiens","4WHJ|4X0R|5UOT","Tbio","","1.233333","2.957086","1.400613","2.098416","2.179132","1.243864","1.97427","2.448271","2.138412","1.774457","2.23108","1.86901","4.783377","1.154768","0.748188","2.232838","2.748586","1.90597","0.355388","1.252044"
"stringdb:9606.ENSP00000346050",,"1.486071","5.0","4.262396",,"4.288618","0.99136","0.544698","1.793544","5.0",,"1.304725","RPS3A",,"9606.ENSP00000346050","9606.ENSP00000346050","false","9606.ENSP00000346050",,"P61247","9606.ENSP00000346050","V-fos transformation effector protein; May play a role during erythropoiesis through regulation of transcription factor DDIT3; Belongs to the eukaryotic ribosomal protein eS1 family.","label: attribute=""display name"" labelsize=12 labelAlignment=left outline=true outlineColor=white outlineTransparency=95 outlineWidth=10 background=false color=black dropShadow=false","","stringdb","protein","MAVGKNKRLTKGGKKGAKKKVVDPFSKKDWYDVKAPAMFNIRNIGKTLVTRTQGTKIASDGLKGRVFEVSLADLQNDEVAFRKFKLITEDVQGKNCLTNFHGMDLTRDKMCSMVKKWQTMIEAHVDVKTTDGYLLRLFCVGFTKKRNNQIRKTSYAQHQQVRQIRKKMMEIMTREVQTNDLKEVVNKLIPDSIGKDIEKACQSIYPLHDVFVRKVKMLKKPKFELGKLMELHGEGSSSGKATGDETGAKVERADGYEPPVQESV","Homo sapiens","","Tbio","","2.24928","4.894547","4.500337","3.136989","4.983797","2.105397","4.03217","4.837163","4.407907","4.957582","4.913058","4.95963","4.987533","4.936455","2.727314","4.976775","3.153565","4.562675","2.354108","2.291665"
"stringdb:9606.ENSP00000354394",,"2.61355","4.809585","2.408831","2.457624","3.383005","2.258803","2.385421","2.606148","5.0","1.82034","2.916257","STAT1",,"9606.ENSP00000354394","9606.ENSP00000354394","false","9606.ENSP00000354394",,"P42224","9606.ENSP00000354394","Signal transducer and activator of transcription 1-alpha/beta; Signal transducer and transcription activator that mediates cellular responses to interferons (IFNs), cytokine KITLG/SCF and other cytokines and other growth factors. Following type I IFN (IFN-alpha and IFN-beta) binding to cell surface receptors, signaling via protein kinases leads to activation of Jak kinases (TYK2 and JAK1) and to tyrosine phosphorylation of STAT1 and STAT2. The phosphorylated STATs dimerize and associate with ISGF3G/IRF-9 to form a complex termed ISGF3 transcription factor, that enters the nucleus. ISGF3 binds to the IFN stimulated response element (ISRE) to activate the transcription of IFN-stimulated genes (ISG), which drive the cell in an antiviral state. In response to type II IFN (IFN-gamma), STAT1 is tyrosine- and serine-phosphorylated. It then forms a homodimer termed IFN-gamma-activated factor (GAF), migrates into the nucleus and binds to the IFN gamma activated sequence (GAS) to drive the expression of the target genes, inducing a cellular antiviral state. Becomes activated in response to KITLG/SCF and KIT signaling. May mediate cellular responses to activated FGFR1, FGFR2, FGFR3 and FGFR4.","label: attribute=""display name"" labelsize=12 labelAlignment=left outline=true outlineColor=white outlineTransparency=95 outlineWidth=10 background=false color=black dropShadow=false","","stringdb","protein","MSQWYELQQLDSKFLEQVHQLYDDSFPMEIRQYLAQWLEKQDWEHAANDVSFATIRFHDLLSQLDDQYSRFSLENNFLLQHNIRKSKRNLQDNFQEDPIQMSMIIYSCLKEERKILENAQRFNQAQSGNIQSTVMLDKQKELDSKVRNVKDKVMCIEHEIKSLEDLQDEYDFKCKTLQNREHETNGVAKSDQKQEQLLLKKMYLMLDNKRKEVVHKIIELLNVTELTQNALINDELVEWKRRQQSACIGGPPNACLDQLQNWFTIVAESLQQVRQQLKKLEELEQKYTYEHDPITKNKQVLWDRTFSLFQQLIQSSFVVERQPCMPTHPQRPLVLKTGVQFTVKLRLLVKLQELNYNLKVKVLFDKDVNERNTVKGFRKFNILGTHTKVMNMEESTNGSLAAEFRHLQLKEQKNAGTRTNEGPLIVTEELHSLSFETQLCQPGLVIDLETTSLPVVVISNVSQLPSGWASILWYNMLVAEPRNLSFFLTPPCARWAQLSEVLSWQFSSVTKRGLNVDQLNMLGEKLLGPNASPDGLIPWTRFCKENINDKNFPFWLWIESILELIKKHLLPLWNDGCIMGFISKERERALLKDQQPGTFLLRFSESSREGAITFTWVERSQNGGEPDFHAVEPYTKKELSAVTFPDIIRNYKVMAAENIPENPLKYLYPNIDKDHAFGKYYSRPKEAPEPMELDGPKGTGYIKTELISVSEVHPSRLQTTDNLLPMSPEEFDEVSRIVGSVEFDSMMNTV","Homo sapiens","","Tchem","TF","2.586451","3.560524","2.137945","3.156431","2.508514","2.292809","3.289251","3.490416","3.465163","4.726286","3.359105","3.292497","4.949015","3.041501","2.842595","4.081982","3.647641","2.868947","2.637704","2.344688"
"stringdb:9606.ENSP00000307889",,"1.395723","4.747427","4.125093",,"1.214628",,,"1.324907","4.569596",,"1.200959","RPL13",,"9606.ENSP00000307889","9606.ENSP00000307889","false","9606.ENSP00000307889",,"P26373","9606.ENSP00000307889","Large ribosomal subunit protein eL13; Ribosomal protein L13","label: attribute=""display name"" labelsize=12 labelAlignment=left outline=true outlineColor=white outlineTransparency=95 outlineWidth=10 background=false color=black dropShadow=false","","stringdb","protein","MAPSRNGMVLKPHFHKDWQRRVATWFNQPARKIRRRKARQAKARRIAPRPASGPIRPIVRCPTVRYHTKVRAGRGFSLEELRVAGIHKKVARTIGISVDPRRRNKSTESLQANVQRLKEYRSKLILFPRKPSAPKKGDSSAEELKLATQLTGPVMPVRNVYKKEKARVITEEEKNFKAFASLRMARANARLFGIRAKRAKEAAEQDVEKKK","Homo sapiens","","Tbio","","2.330143","4.670859","2.873884","2.797147","4.616501","2.554093","3.064762","4.518536","4.511488","4.694478","4.806083","4.398693","4.983296","4.81005","2.568749","4.686813","3.028426","3.412635","2.216254","2.360972"
"stringdb:9606.ENSP00000346012",,"0.748066","4.613359","4.125434",,"1.994302",,,"1.134076","4.374238",,"4.120503","RPL36AL",,"9606.ENSP00000346012","9606.ENSP00000346012","false","9606.ENSP00000346012",,"R4GN19","9606.ENSP00000346012","Ribosomal protein L36a like","label: attribute=""display name"" labelsize=12 labelAlignment=left outline=true outlineColor=white outlineTransparency=95 outlineWidth=10 background=false color=black dropShadow=false","","stringdb","protein","MVNVPKTRRTFCKKCGKHQPHKVTQYKKGKDSLYAQGRRRYDRKQSGYGGQTKPIFRKKAKTTKKIVLRLECVEPNCRSKRMLAIKRCKHFELGGDKKRKGQVIQF","Homo sapiens","","Tbio","","2.199572","3.147006",,"2.088254","1.338456","1.986174","2.785384","2.126456","4.619045","2.975372","2.262601","4.456785","3.121422","1.993583","2.159768","1.926685","2.405568","2.119915","2.077731","2.053078"
"stringdb:9606.ENSP00000368699",,"2.070811","4.772899","2.012979","2.273101","5.0","1.381139","1.991157","2.08144","4.652141","1.411018","2.144443","ISG15",,"9606.ENSP00000368699","9606.ENSP00000368699","false","9606.ENSP00000368699",,"P05161","9606.ENSP00000368699","Interferon-induced 15 kDa protein; Ubiquitin-like protein which plays a key role in the innate immune response to viral infection either via its conjugation to a target protein (ISGylation) or via its action as a free or unconjugated protein. ISGylation involves a cascade of enzymatic reactions involving E1, E2, and E3 enzymes which catalyze the conjugation of ISG15 to a lysine residue in the target protein. Its target proteins include IFIT1, MX1/MxA, PPM1B, UBE2L6, UBA7, CHMP5, CHMP2A, CHMP4B and CHMP6. Can also isgylate: EIF2AK2/PKR which results in its activation, DDX58/RIG-I which inhibits its function in antiviral signaling response, EIF4E2 which enhances its cap structure-binding activity and translation- inhibition activity, UBE2N and UBE2E1 which negatively regulates their activity, IRF3 which inhibits its ubiquitination and degradation and FLNB which prevents its ability to interact with the upstream activators of the JNK cascade therby inhibiting IFNA- induced JNK signaling. Exhibits antiviral activity towards both DNA and RNA viruses, including influenza A, HIV-1 and Ebola virus. Restricts HIV-1 and ebola virus via disruption of viral budding. Inhibits the ubiquitination of HIV-1 Gag and host TSG101 and disrupts their interaction, thereby preventing assembly and release of virions from infected cells. Inhibits Ebola virus budding mediated by the VP40 protein by disrupting ubiquitin ligase activity of NEDD4 and its ability to ubiquitinate VP40. ISGylates influenza A virus NS1 protein which causes a loss of function of the protein and the inhibition of virus replication. The secreted form of ISG15 can: induce natural killer cell proliferation, act as a chemotactic factor for neutrophils and act as a IFN-gamma-inducing cytokine playing an essential role in antimycobacterial immunity.","label: attribute=""display name"" labelsize=12 labelAlignment=left outline=true outlineColor=white outlineTransparency=95 outlineWidth=10 background=false color=black dropShadow=false","","stringdb","protein","MGWDLTVKMLAGNEFQVSLSSSMSVSELKAQITQKIGVHAFQQRLAVHPSGVALQDRVPLASQGLGPGSTVLLVVDKCDEPLSILVRNNKGRSSTYEVRLTQTVAHLKQQVSGLEGVQDDLFWLTFEGKPLEDQLPLGEYGLKPLSTVFMNLRLRGGGTEPGGRS","Homo sapiens","1Z2M|2HJ8|3PHX|3PSE|3R66|3RT3|3SDL|5TL6|5W8T|5W8U|6BI8|6FFA","Tbio","","1.090909","3.046709","1.428095","2.745327","1.447571","1.227029","2.427752","4.50998","2.80376","4.541969","2.857193","2.335287","2.523461","2.006295","2.624393","2.028362","3.149691","2.058661","1.272638","1.104942"
