"stringdb:9606.ENSP00000215832",,"5.0","5.0","4.434339","5.0","4.559836","5.0","4.426206","5.0","5.0","1.513441","4.543532","MAPK1",,"9606.ENSP00000215832","9606.ENSP00000215832","false","9606.ENSP00000215832",,"P28482","9606.ENSP00000215832","Extracellular signal-regulated kinase 2; Serine/threonine kinase which acts as an essential component of the MAP kinase signal transduction pathway. MAPK1/ERK2 and MAPK3/ERK1 are the 2 MAPKs which play an important role in the MAPK/ERK cascade. They participate also in a signaling cascade initiated by activated KIT and KITLG/SCF. Depending on the cellular context, the MAPK/ERK cascade mediates diverse biological functions such as cell growth, adhesion, survival and differentiation through the regulation of transcription, translation, cytoskeletal rearrangements. The MAPK/ERK cascade plays also a role in initiation and regulation of meiosis, mitosis, and postmitotic functions in differentiated cells by phosphorylating a number of transcription factors. About 160 substrates have already been discovered for ERKs. Many of these substrates are localized in the nucleus, and seem to participate in the regulation of transcription upon stimulation. However, other substrates are found in the cytosol as well as in other cellular organelles, and those are responsible for processes such as translation, mitosis and apoptosis. Moreover, the MAPK/ERK cascade is also involved in the regulation of the endosomal dynamics, including lysosome processing and endosome cycling through the perinuclear recycling compartment (PNRC); as well as in the fragmentation of the Golgi apparatus during mitosis. The substrates include transcription factors (such as ATF2, BCL6, ELK1, ERF, FOS, HSF4 or SPZ1), cytoskeletal elements (such as CANX, CTTN, GJA1, MAP2, MAPT, PXN, SORBS3 or STMN1), regulators of apoptosis (such as BAD, BTG2, CASP9, DAPK1, IER3, MCL1 or PPARG), regulators of translation (such as EIF4EBP1) and a variety of other signaling-related molecules (like ARHGEF2, DCC, FRS2 or GRB10). Protein kinases (such as RAF1, RPS6KA1/RSK1, RPS6KA3/RSK2, RPS6KA2/RSK3, RPS6KA6/RSK4, SYK, MKNK1/MNK1, MKNK2/MNK2, RPS6KA5/MSK1, RPS6KA4/MSK2, MAPKAPK3 or MAPKAPK5) and phosphatases (such as DUSP1, DUSP4, DUSP6 or DUSP16) are other substrates which enable the propagation the MAPK/ERK signal to additional cytosolic and nuclear targets, thereby extending the specificity of the cascade. Mediates phosphorylation of TPR in respons to EGF stimulation. May play a role in the spindle assembly checkpoint. Phosphorylates PML and promotes its interaction with PIN1, leading to PML degradation. Phosphorylates CDK2AP2 (By similarity).","label: attribute=""display name"" labelsize=12 labelAlignment=left outline=true outlineColor=white outlineTransparency=95 outlineWidth=10 background=false color=black dropShadow=false","","stringdb","protein","MAAAAAAGAGPEMVRGQVFDVGPRYTNLSYIGEGAYGMVCSAYDNVNKVRVAIKKISPFEHQTYCQRTLREIKILLRFRHENIIGINDIIRAPTIEQMKDVYIVQDLMETDLYKLLKTQHLSNDHICYFLYQILRGLKYIHSANVLHRDLKPSNLLLNTTCDLKICDFGLARVADPDHDHTGFLTEYVATRWYRAPEIMLNSKGYTKSIDIWSVGCILAEMLSNRPIFPGKHYLDQLNHILGILGSPSQEDLNCIINLKARNYLLSLPHKNKVPWNRLFPNADSKALDLLDKMLTFNPHKRIEVEQALAHPYLEQYYDPSDEPIAEAPFKFDMELDDLPKEKLKELIFEETARFQPGYRS","Homo sapiens","1PME|1TVO|1WZY|2OJG|2OJI|2OJJ|2Y9Q|3D42|3D44|3I5Z|3I60|3SA0|3TEI|3W55|4FMQ|4FUX|4FUY|4FV0|4FV1|4FV2|4FV3|4FV4|4FV5|4FV6|4FV7|4FV8|4FV9|4G6N|4G6O|4H3P|4H3Q|4IZ5|4IZ7|4IZA|4N0S|4NIF|4O6E|4QP1|4QP2|4QP3|4QP4|4QP6|4QP7|4QP8|4QP9|4QPA|4QTA|4QTE|4XJ0|4ZXT|4ZZM|4ZZN|4ZZO|5AX3|5BUE|5BUI|5BUJ|5BVD|5BVE|5BVF|5K4I|5LCJ|5LCK|5NGU|5NHF|5NHH|5NHJ|5NHL|5NHO|5NHP|5NHV|5V60|5V61|5V62|5WP1|6D5Y|6DMG|6G54|6G8X|6G91|6G92|6G93|6G97|6G9A|6G9D|6G9H|6G9J|6G9K|6G9M|6G9N|6GDM|6GDQ|6GE0|6GJB|6GJD|6Q7K|6QAG|6QAL|6QAQ|6QAW","Tchem","Kinase","2.652373","4.573195","2.182185","2.579206","3.004404","1.80678","3.039272","3.102898","3.082478","4.586139","4.627952","2.988374","4.92638","2.612766","1.924827","3.337889","2.893735","2.608844","2.571072","1.880264"
"stringdb:9606.ENSP00000397798",,"1.117394","4.599307","0.701471",,"0.662724",,,"1.114795","4.310487",,,"RPL17",,"9606.ENSP00000397798","9606.ENSP00000397798","false","9606.ENSP00000397798",,"P18621","9606.ENSP00000397798","Large ribosomal subunit protein uL22; Component of the large ribosomal subunit; Belongs to the universal ribosomal protein uL22 family.","label: attribute=""display name"" labelsize=12 labelAlignment=left outline=true outlineColor=white outlineTransparency=95 outlineWidth=10 background=false color=black dropShadow=false","","stringdb","protein","MVRYSLDPENPTKSCKSRGSNLRVHFKNTRETAQAIKGMHIRKATKYLKDVTLQKQCVPFRRYNGGVGRCAQAKQWGWTQGRWPKKSAEFLLHMLKNAESNAELKGLDVDSLVIEHIQVNKAPKMRRRTYRAHGRINPYMSSPCHIEMILTEKEQIVPKPEEEVAQKKKISQKKLKKQKLMARE","Homo sapiens","","Tbio","","1.965672","4.709947","2.98687","1.485721","4.444296","0.866667","3.899598","4.26686","4.260348","4.357464","4.948046","4.193102","4.950681","3.867464","1.915664","4.513269","2.624135","3.524225","2.051153","0.866667"
"stringdb:9606.ENSP00000260443",,"1.155343","4.329845","0.937385",,"1.385101",,,"2.334006","4.729588",,"0.570964","RSL24D1",,"9606.ENSP00000260443","9606.ENSP00000260443","false","9606.ENSP00000260443",,"Q9UHA3","9606.ENSP00000260443","Probable ribosome biogenesis protein RLP24; Involved in the biogenesis of the 60S ribosomal subunit. Ensures the docking of GTPBP4/NOG1 to pre-60S particles (By similarity); Belongs to the eukaryotic ribosomal protein eL24 family.","label: attribute=""display name"" labelsize=12 labelAlignment=left outline=true outlineColor=white outlineTransparency=95 outlineWidth=10 background=false color=black dropShadow=false","","stringdb","protein","MRIEKCYFCSGPIYPGHGMMFVRNDCKVFRFCKSKCHKNFKKKRNPRKVRWTKAFRKAAGKELTVDNSFEFEKRRNEPIKYQRELWNKTIDAMKRVEEIKQKRQAKFIMNRLKKNKELQKVQDIKEVKQNIHLIRAPLAGKGKQLEEKMVQQLQEDVDMEDAP","Homo sapiens","","Tbio","","1.393283","4.431769","1.04632","4.440708","1.786587","1.346353","1.773994","2.130317","3.065596","4.56682","4.579852","3.067857","4.95301","2.586747","1.264818","3.543255","4.353496","1.350248","1.473244","4.29005"
"stringdb:9606.ENSP00000233057",,"1.797317","4.692741","2.246289","1.54853","1.797939","1.293773","1.547079","1.985556","4.364891","0.925418","1.639927","EIF2AK2",,"9606.ENSP00000233057","9606.ENSP00000233057","false","9606.ENSP00000233057",,"P19525","9606.ENSP00000233057","Interferon-induced, double-stranded RNA-activated protein kinase; IFN-induced dsRNA-dependent serine/threonine-protein kinase which plays a key role in the innate immune response to viral infection and is also involved in the regulation of signal transduction, apoptosis, cell proliferation and differentiation. Exerts its antiviral activity on a wide range of DNA and RNA viruses including hepatitis C virus (HCV), hepatitis B virus (HBV), measles virus (MV) and herpes simplex virus 1 (HHV-1). Inhibits viral replication via phosphorylation of the alpha subunit of eukaryotic initiation factor 2 (EIF2S1), this phosphorylation impairs the recycling of EIF2S1 between successive rounds of initiation leading to inhibition of translation which eventually results in shutdown of cellular and viral protein synthesis. Also phosphorylates other substrates including p53/TP53, PPP2R5A, DHX9, ILF3, IRS1 and the HHV-1 viral protein US11. In addition to serine/threonine-protein kinase activity, also has tyrosine-protein kinase activity and phosphorylates CDK1 at 'Tyr-4' upon DNA damage, facilitating its ubiquitination and proteosomal degradation. Either as an adapter protein and/or via its kinase activity, can regulate various signaling pathways (p38 MAP kinase, NF-kappa-B and insulin signaling pathways) and transcription factors (JUN, STAT1, STAT3, IRF1, ATF3) involved in the expression of genes encoding proinflammatory cytokines and IFNs. Activates the NF-kappa-B pathway via interaction with IKBKB and TRAF family of proteins and activates the p38 MAP kinase pathway via interaction with MAP2K6. Can act as both a positive and negative regulator of the insulin signaling pathway (ISP). Negatively regulates ISP by inducing the inhibitory phosphorylation of insulin receptor substrate 1 (IRS1) at 'Ser- 312' and positively regulates ISP via phosphorylation of PPP2R5A which activates FOXO1, which in turn up-regulates the expression of insulin receptor substrate 2 (IRS2). Can regulate NLRP3 inflammasome assembly and the activation of NLRP3, NLRP1, AIM2 and NLRC4 inflammasomes. Can trigger apoptosis via FADD-mediated activation of CASP8. Plays a role in the regulation of the cytoskeleton by binding to gelsolin (GSN), sequestering the protein in an inactive conformation away from actin.","label: attribute=""display name"" labelsize=12 labelAlignment=left outline=true outlineColor=white outlineTransparency=95 outlineWidth=10 background=false color=black dropShadow=false","","stringdb","protein","MAGDLSAGFFMEELNTYRQKQGVVLKYQELPNSGPPHDRRFTFQVIIDGREFPEGEGRSKKEAKNAAAKLAVEILNKEKKAVSPLLLTTTNSSEGLSMGNYIGLINRIAQKKRLTVNYEQCASGVHGPEGFHYKCKMGQKEYSIGTGSTKQEAKQLAAKLAYLQILSEETSVKSDYLSSGSFATTCESQSNSLVTSTLASESSSEGDFSADTSEINSNSDSLNSSSLLMNGLRNNQRKAKRSLAPRFDLPDMKETKYTVDKRFGMDFKEIELIGSGGFGQVFKAKHRIDGKTYVIKRVKYNNEKAEREVKALAKLDHVNIVHYNGCWDGFDYDPETSDDSLESSDYDPENSKNSSRSKTKCLFIQMEFCDKGTLEQWIEKRRGEKLDKVLALELFEQITKGVDYIHSKKLIHRDLKPSNIFLVDTKQVKIGDFGLVTSLKNDGKRTRSKGTLRYMSPEQISSQDYGKEVDLYALGLILAELLHVCDTAFETSKFFTDLRDGIISDIFDKKEKTLLQKLLSKKPEDRPNTSEILRTLTVWKKSPEKNERHTC","Homo sapiens","1QU6|2A19|2A1A|3UIU","Tchem","Kinase","1.409086","2.293095","0.966927","2.063633","1.549322","0.966924","2.291259","1.902264","2.3948","4.473028","2.262438","2.182494","4.501246","1.862494","1.503746","1.56066","2.546283","1.416847","1.635026","0.973128"
"stringdb:9606.ENSP00000262741",,"2.690992","4.800261","1.15517","1.066917","1.667081","0.704207","1.083041","1.303064","3.36084","0.762949","2.056266","PIK3R3",,"9606.ENSP00000262741","9606.ENSP00000262741","false","9606.ENSP00000262741",,"Q92569","9606.ENSP00000262741","Phosphatidylinositol 3-kinase 55 kDa regulatory subunit gamma; Binds to activated (phosphorylated) protein-tyrosine kinases through its SH2 domain and regulates their kinase activity. During insulin stimulation, it also binds to IRS-1.","label: attribute=""display name"" labelsize=12 labelAlignment=left outline=true outlineColor=white outlineTransparency=95 outlineWidth=10 background=false color=black dropShadow=false","","stringdb","protein","MYNTVWSMDRDDADWREVMMPYSTELIFYIEMDPPALPPKPPKPMTSAVPNGMKDSSVSLQDAEWYWGDISREEVNDKLRDMPDGTFLVRDASTKMQGDYTLTLRKGGNNKLIKIYHRDGKYGFSDPLTFNSVVELINHYHHESLAQYNPKLDVKLMYPVSRYQQDQLVKEDNIDAVGKKLQEYHSQYQEKSKEYDRLYEEYTRTSQEIQMKRTAIEAFNETIKIFEEQCHTQEQHSKEYIERFRREGNEKEIERIMMNYDKLKSRLGEIHDSKMRLEQDLKNQALDNREIDKKMNSIKPDLIQLRKIRDQHLVWLNHKGVRQKRLNVWLGIKNEDADENYFINEEDENLPHYDEKTWFVEDINRVQAEDLLYGKPDGAFLIRESSKKGCYACSVVADGEVKHCVIYSTARGYGFAEPYNLYSSLKELVLHYQQTSLVQHNDSLNVRLAYPVHAQMPSLCR","Homo sapiens","","Tbio","Enzyme","1.380853","2.088232","0.82831","1.479115","1.101799","1.030735","2.428122","1.932789","2.150987","1.898799","2.092449","2.427512","4.818568","2.049968","0.687232","1.621782","2.086419","1.280205","1.735598","1.098067"
"stringdb:9606.ENSP00000430684",,"2.431513","4.884061","2.258519","2.061722","2.673063","1.443053","2.109687","2.51939","4.386676","1.83427","4.069857","IKBKB",,"9606.ENSP00000430684","9606.ENSP00000430684","false","9606.ENSP00000430684",,"O14920","9606.ENSP00000430684","Inhibitor of kappa light polypeptide gene enhancer in B-cells, kinase beta; Serine kinase that plays an essential role in the NF- kappa-B signaling pathway which is activated by multiple stimuli such as inflammatory cytokines, bacterial or viral products, DNA damages or other cellular stresses. Acts as part of the canonical IKK complex in the conventional pathway of NF-kappa-B activation and phosphorylates inhibitors of NF-kappa-B on 2 critical serine residues. These modifications allow polyubiquitination of the inhibitors and subsequent degradation by the proteasome. In turn, free NF-kappa-B is translocated into the nucleus and activates the transcription of hundreds of genes involved in immune response, growth control, or protection against apoptosis. In addition to the NF-kappa-B inhibitors, phosphorylates several other components of the signaling pathway including NEMO/IKBKG, NF-kappa-B subunits RELA and NFKB1, as well as IKK-related kinases TBK1 and IKBKE. IKK-related kinase phosphorylations may prevent the overproduction of inflammatory mediators since they exert a negative regulation on canonical IKKs. Phosphorylates FOXO3, mediating the TNF- dependent inactivation of this pro-apoptotic transcription factor. Also phosphorylates other substrates including NCOA3, BCL10 and IRS1. Within the nucleus, acts as an adapter protein for NFKBIA degradation in UV-induced NF-kappa-B activation.","label: attribute=""display name"" labelsize=12 labelAlignment=left outline=true outlineColor=white outlineTransparency=95 outlineWidth=10 background=false color=black dropShadow=false","","stringdb","protein","MSWSPSLTTQTCGAWEMKERLGTGGFGNVIRWHNQETGEQIAIKQCRQELSPRNRERWCLEIQIMRRLTHPNVVAARDVPEGMQNLAPNDLPLLAMEYCQGGDLRKYLNQFENCCGLREGAILTLLSDIASALRYLHENRIIHRDLKPENIVLQQGEQRLIHKIIDLGYAKELDQGSLCTSFVGTLQYLAPELLEQQKYTVTVDYWSFGTLAFECITGFRPFLPNWQPVQWHSKVRQKSEVDIVVSEDLNGTVKFSSSLPYPNNLNSVLAERLEKWLQLMLMWHPRQRGTDPTYGPNGCFKALDDILNLKLVHILNMVTGTIHTYPVTEDESLQSLKARIQQDTGIPEEDQELLQEAGLALIPDKPATQCISDGKLNEGHTLDMDLVFLFDNSKITYETQISPRPQPESVSCILQEPKRNLAFFQLRKVWGQVWHSIQTLKEDCNRLQQGQRAAMMNLLRNNSCLSKMKNSMASMSQQLKAKLDFFKTSIQIDLEKYSEQTEFGITSDKLLLAWREMEQAVELCGRENEVKLLVERMMALQTDIVDLQRSPMGRKQGGTLDDLEEQARELYRRLREKPRDQRTEGDSQEMVRLLLQAIQSFEKKVRVIYTQLSKTVVCKQKALELLPKVEEVVSLMNEDEKTVVRLQEKRQKELWNLLKIACSKVRGPVSGSPDSMNASRLSQPGQLMSQPSTASNSLPEPAKKSEELVAEAHNLCTLLENAIQDTVREQDQSFTALDWSWLQTEEEEHSCLEQAS","Homo sapiens","3BRT|3BRV|4E3C|4KIK","Tchem","Kinase","2.193616","3.065305","1.960944","2.702332","1.965246","1.894624","4.563132","3.060006","2.807895","4.561745","4.58067","2.81668","4.399429","2.475207","1.971009","3.336374","3.072876","2.558095","2.265468","1.39678"
"stringdb:9606.ENSP00000394560",,"2.313701","4.697015","2.113415","1.442028","2.367362","1.388191","1.849988","3.434372","4.625787","1.164194","2.479915","MAPK9",,"9606.ENSP00000394560","9606.ENSP00000394560","false","9606.ENSP00000394560",,"Q8N5C5","9606.ENSP00000394560","Stress-activated protein kinase JNK2; Serine/threonine-protein kinase involved in various processes such as cell proliferation, differentiation, migration, transformation and programmed cell death. Extracellular stimuli such as proinflammatory cytokines or physical stress stimulate the stress-activated protein kinase/c-Jun N-terminal kinase (SAP/JNK) signaling pathway. In this cascade, two dual specificity kinases MAP2K4/MKK4 and MAP2K7/MKK7 phosphorylate and activate MAPK9/JNK2. In turn, MAPK9/JNK2 phosphorylates a number of transcription factors, primarily components of AP-1 such as JUN and ATF2 and thus regulates AP-1 transcriptional activity. In response to oxidative or ribotoxic stresses, inhibits rRNA synthesis by phosphorylating and inactivating the RNA polymerase 1-specific transcription initiation factor RRN3. Promotes stressed cell apoptosis by phosphorylating key regulatory factors including TP53 and YAP1. In T-cells, MAPK8 and MAPK9 are required for polarized differentiation of T-helper cells into Th1 cells. Upon T-cell receptor (TCR) stimulation, is activated by CARMA1, BCL10, MAP2K7 and MAP3K7/TAK1 to regulate JUN protein levels. Plays an important role in the osmotic stress-induced epithelial tight-junctions disruption. When activated, promotes beta-catenin/CTNNB1 degradation and inhibits the canonical Wnt signaling pathway. Participates also in neurite growth in spiral ganglion neurons. Phosphorylates the CLOCK-ARNTL/BMAL1 heterodimer and plays a role in the regulation of the circadian clock.","label: attribute=""display name"" labelsize=12 labelAlignment=left outline=true outlineColor=white outlineTransparency=95 outlineWidth=10 background=false color=black dropShadow=false","","stringdb","protein","MSDSKCDSQFYSVQVADSTFTVLKRYQQLKPIGSGAQGIVCAAFDTVLGINVAVKKLSRPFQNQTHAKRAYRELVLLKCVNHKNIISLLNVFTPQKTLEEFQDVYLVMELMDANLCQVIHMELDHERMSYLLYQMLCGIKHLHSAGIIHRDLKPSNIVVKSDCTLKILDFGLARTACTNFMMTPYVVTRYYRAPEVILGMGYKENVDIWSVGCIMGELVKGCVIFQGTDHIDQWNKVIEQLGTPSAEFMKKLQPTVRNYVENRPKYPGIKFEELFPDWIFPSESERDKIKTSQARDLLSKMLVIDPDKRISVDEALRHPYITVWYDPAEAEAPPPQIYDAQLEEREHAIEEWKELIYKEVMDWEERSKNGVVKDQPSDAAVSSNATPSQSSSINDISSMSTEQTLASDTDSSLDASTGPLEGCR","Homo sapiens","","Tchem","Kinase","2.286712","2.500697","1.620359","2.197191","2.023519","1.438749","2.742714","2.515981","2.574791","2.588343","2.525258","2.686016","4.853206","2.393863","1.462339","4.457673","2.287587","2.125908","2.107105","1.08398"
"stringdb:9606.ENSP00000345957",,"1.352473","5.0","3.335183",,"1.345509","0.530148",,"1.569373","4.503087","0.580543","1.130182","RPS21",,"9606.ENSP00000345957","9606.ENSP00000345957","false","9606.ENSP00000345957",,"P63220","9606.ENSP00000345957","Small ribosomal subunit protein eS21; Ribosomal protein S21; Belongs to the eukaryotic ribosomal protein eS21 family.","label: attribute=""display name"" labelsize=12 labelAlignment=left outline=true outlineColor=white outlineTransparency=95 outlineWidth=10 background=false color=black dropShadow=false","","stringdb","protein","MQNDAGEFVDLYVPRKCSASNRIIGAKDHASIQMNVAEVDKVTGRFNGQFKTYAICGAIRRMGESDDSILRLAKADGIVSKNF","Homo sapiens","","Tbio","","2.866864","4.579689","1.805965","2.846378","1.80956","2.635685","2.963903","3.1211","2.950655","4.771546","3.481766","3.844775","4.24153","3.518153","2.780365","3.211763","2.92396","2.894934","2.720104","2.754399"
"stringdb:9606.ENSP00000275493",,"3.360671","4.103765","2.718432","5.0","5.0","4.025996","3.134948","2.932086","5.0","2.111514","5.0","EGFR",,"9606.ENSP00000275493","9606.ENSP00000275493","false","9606.ENSP00000275493",,"Q9H2C9","9606.ENSP00000275493","Receptor tyrosine-protein kinase erbB-1; Receptor tyrosine kinase binding ligands of the EGF family and activating several signaling cascades to convert extracellular cues into appropriate cellular responses. Known ligands include EGF, TGFA/TGF-alpha, amphiregulin, epigen/EPGN, BTC/betacellulin, epiregulin/EREG and HBEGF/heparin-binding EGF. Ligand binding triggers receptor homo- and/or heterodimerization and autophosphorylation on key cytoplasmic residues. The phosphorylated receptor recruits adapter proteins like GRB2 which in turn activates complex downstream signaling cascades. Activates at least 4 major downstream signaling cascades including the RAS- RAF-MEK-ERK, PI3 kinase-AKT, PLCgamma-PKC and STATs modules. May also activate the NF-kappa-B signaling cascade. Also directly phosphorylates other proteins like RGS16, activating its GTPase activity and probably coupling the EGF receptor signaling to the G protein-coupled receptor signaling. Also phosphorylates MUC1 and increases its interaction with SRC and CTNNB1/beta-catenin. Plays a role in enhancing learning and memory performance (By similarity).","label: attribute=""display name"" labelsize=12 labelAlignment=left outline=true outlineColor=white outlineTransparency=95 outlineWidth=10 background=false color=black dropShadow=false","","stringdb","protein","MRPSGTAGAALLALLAALCPASRALEEKKVCQGTSNKLTQLGTFEDHFLSLQRMFNNCEVVLGNLEITYVQRNYDLSFLKTIQEVAGYVLIALNTVERIPLENLQIIRGNMYYENSYALAVLSNYDANKTGLKELPMRNLQEILHGAVRFSNNPALCNVESIQWRDIVSSDFLSNMSMDFQNHLGSCQKCDPSCPNGSCWGAGEENCQKLTKIICAQQCSGRCRGKSPSDCCHNQCAAGCTGPRESDCLVCRKFRDEATCKDTCPPLMLYNPTTYQMDVNPEGKYSFGATCVKKCPRNYVVTDHGSCVRACGADSYEMEEDGVRKCKKCEGPCRKVCNGIGIGEFKDSLSINATNIKHFKNCTSISGDLHILPVAFRGDSFTHTPPLDPQELDILKTVKEITGFLLIQAWPENRTDLHAFENLEIIRGRTKQHGQFSLAVVSLNITSLGLRSLKEISDGDVIISGNKNLCYANTINWKKLFGTSGQKTKIISNRGENSCKATGQVCHALCSPEGCWGPEPRDCVSCRNVSRGRECVDKCNLLEGEPREFVENSECIQCHPECLPQAMNITCTGRGPDNCIQCAHYIDGPHCVKTCPAGVMGENNTLVWKYADAGHVCHLCHPNCTYGCTGPGLEGCPTNGPKIPSIATGMVGALLLLLVVALGIGLFMRRRHIVRKRTLRRLLQERELVEPLTPSGEAPNQALLRILKETEFKKIKVLGSGAFGTVYKGLWIPEGEKVKIPVAIKELREATSPKANKEILDEAYVMASVDNPHVCRLLGICLTSTVQLITQLMPFGCLLDYVREHKDNIGSQYLLNWCVQIAKGMNYLEDRRLVHRDLAARNVLVKTPQHVKITDFGLAKLLGAEEKEYHAEGGKVPIKWMALESILHRIYTHQSDVWSYGVTVWELMTFGSKPYDGIPASEISSILEKGERLPQPPICTIDVYMIMVKCWMIDADSRPKFRELIIEFSKMARDPQRYLVIQGDERMHLPSPTDSNFYRALMDEEDMDDVVDADEYLIPQQGFFSSPSTSRTPLLSSLSATSNNSTVACIDRNGLQSCPIKEDSFLQRYSSDPTGALTEDSIDDTFLPVPEYINQSVPKRPAGSVQNPVYHNQPLNPAPSRDPHYQDPHSTAVGNPEYLNTVQPTCVNSTFDSPAHWAQKGSHQISLDNPDYQQDFFPKEAKPNGIFKGSTAENAEYLRVAPQSSEFIGA","Homo sapiens","","Tclin","Kinase","2.628075","3.10718","2.28561","2.443705","3.048122","2.376631","3.13598","3.561361","3.252371","4.719755","3.377009","3.084764","4.324858","2.95224","2.800986","3.420425","2.963246","2.894227","2.97127","2.403918"
"stringdb:9606.ENSP00000379506",,"1.100524","4.78698","0.70752",,"4.184157",,,"2.568059","2.122912",,"0.816955","RPL14",,"9606.ENSP00000379506","9606.ENSP00000379506","false","9606.ENSP00000379506",,"Q9BYF6","9606.ENSP00000379506","Large ribosomal subunit protein eL14; Component of the large ribosomal subunit; Belongs to the eukaryotic ribosomal protein eL14 family.","label: attribute=""display name"" labelsize=12 labelAlignment=left outline=true outlineColor=white outlineTransparency=95 outlineWidth=10 background=false color=black dropShadow=false","","stringdb","protein","MVFRRFVEVGRVAYVSFGPHAGKLVAIVDVIDQNRALVDGPCTQVRRQAMPFKCMQLTDFILKFPHSAHQKYVRQAWQKADINTKWAATRWAKKIEARERKAKMTDFDRFKVMKAKKMRNRIIKNEVKKLQKAALLKASPKKAPGTKGTAAAAAAAAAAKVPAKKITAASKKAPAQKVPAQKATGQKAAPAPKAQKGQKAPAQKAPAPKASGKKA","Homo sapiens","","Tbio","","1.896893","4.738719","2.364206","1.970966","3.600105","1.777668","2.929916","4.364445","4.932152","3.732337","4.782376","4.637546","4.932051","4.6995","2.009168","4.893819","2.949304","2.234056","4.087164","1.899821"
"stringdb:9606.ENSP00000378974",,"2.733316","4.782485","2.630683","2.031153","2.884161","1.760421","2.306985","3.713853","5.0","1.897027","2.777973","MAPK8",,"9606.ENSP00000378974","9606.ENSP00000378974","false","9606.ENSP00000378974",,"P45983","9606.ENSP00000378974","Stress-activated protein kinase JNK1; Serine/threonine-protein kinase involved in various processes such as cell proliferation, differentiation, migration, transformation and programmed cell death. Extracellular stimuli such as proinflammatory cytokines or physical stress stimulate the stress-activated protein kinase/c-Jun N-terminal kinase (SAP/JNK) signaling pathway. In this cascade, two dual specificity kinases MAP2K4/MKK4 and MAP2K7/MKK7 phosphorylate and activate MAPK8/JNK1. In turn, MAPK8/JNK1 phosphorylates a number of transcription factors, primarily components of AP-1 such as JUN, JDP2 and ATF2 and thus regulates AP-1 transcriptional activity. Phosphorylates the replication licensing factor CDT1, inhibiting the interaction between CDT1 and the histone H4 acetylase HBO1 to replication origins. Loss of this interaction abrogates the acetylation required for replication initiation. Promotes stressed cell apoptosis by phosphorylating key regulatory factors including p53/TP53 and Yes-associates protein YAP1. In T-cells, MAPK8 and MAPK9 are required for polarized differentiation of T-helper cells into Th1 cells. Contributes to the survival of erythroid cells by phosphorylating the antagonist of cell death BAD upon EPO stimulation. Mediates starvation-induced BCL2 phosphorylation, BCL2 dissociation from BECN1, and thus activation of autophagy. Phosphorylates STMN2 and hence regulates microtubule dynamics, controlling neurite elongation in cortical neurons. In the developing brain, through its cytoplasmic activity on STMN2, negatively regulates the rate of exit from multipolar stage and of radial migration from the ventricular zone. Phosphorylates several other substrates including heat shock factor protein 4 (HSF4), the deacetylase SIRT1, ELK1, or the E3 ligase ITCH. Phosphorylates the CLOCK-ARNTL/BMAL1 heterodimer and plays a role in the regulation of the circadian clock. Phosphorylates the heat shock transcription factor HSF1, suppressing HSF1-induced transcriptional activity.","label: attribute=""display name"" labelsize=12 labelAlignment=left outline=true outlineColor=white outlineTransparency=95 outlineWidth=10 background=false color=black dropShadow=false","","stringdb","protein","MSRSKRDNNFYSVEIGDSTFTVLKRYQNLKPIGSGAQGIVCAAYDAILERNVAIKKLSRPFQNQTHAKRAYRELVLMKCVNHKNIIGLLNVFTPQKSLEEFQDVYIVMELMDANLCQVIQMELDHERMSYLLYQMLCGIKHLHSAGIIHRDLKPSNIVVKSDCTLKILDFGLARTAGTSFMMTPYVVTRYYRAPEVILGMGYKENVDIWSVGCIMGEMIKGGVLFPGTDHIDQWNKVIEQLGTPCPEFMKKLQPTVRTYVENRPKYAGYSFEKLFPDVLFPADSEHNKLKASQARDLLSKMLVIDASKRISVDEALQHPYINVWYDPSEAEAPPPKIPDKQLDEREHTIEEWKELIYKEVMDLEERTKNGVIRGQPSPLGAAVINGSQHPSSSSSVNDVSSMSTDPTLASDTDSSLEAAAGPLGCCR","Homo sapiens","","Tchem","Kinase","2.539586","2.880179","2.072891","2.625262","2.420215","2.152895","3.044501","3.046982","2.992523","3.148298","2.842915","3.014486","4.785322","2.652601","2.057635","2.719809","2.709799","2.50254","2.584066","1.810477"
"stringdb:9606.ENSP00000467466",,"1.398561","5.0","1.064308","0.545812","1.173054","0.574998","0.811726","1.571405","5.0",,"1.026637","RPS15",,"9606.ENSP00000467466","9606.ENSP00000467466","false","9606.ENSP00000467466",,"P62841","9606.ENSP00000467466","Small ribosomal subunit protein uS19; Ribosomal protein S15","label: attribute=""display name"" labelsize=12 labelAlignment=left outline=true outlineColor=white outlineTransparency=95 outlineWidth=10 background=false color=black dropShadow=false","","stringdb","protein","MAEVEQKKKRTFRKFTYRGVDLDQLLDMSYEQLMQLYSARQRRRLNRGLRRKQHSLLKRLRKAKKEAPPMEKPEVVKTHLRDMIILPEMVGSMVGVYNGKTFNQVEIKPEMIGHYLGEFSITYKPVKHGRPGIGATHSSRFIPLK","Homo sapiens","","Tbio","","2.436957","4.767008","2.253505","2.911088","3.713678","1.68604","2.98722","3.926174","3.241557","4.703363","3.665222","4.084645","4.948741","4.924537","2.872638","3.924481","3.132217","2.85134","2.710879","1.771342"
