"stringdb:9606.ENSP00000263967",,"2.575006","4.768852","1.870713","1.72074","2.591415","1.842128","1.782882","3.175421","3.397617","1.221636","4.156536","PIK3CA",,"9606.ENSP00000263967","9606.ENSP00000263967","false","9606.ENSP00000263967",,"P42336","9606.ENSP00000263967","Phosphatidylinositol 4,5-bisphosphate 3-kinase 110 kDa catalytic subunit alpha; Phosphoinositide-3-kinase (PI3K) that phosphorylates PtdIns (Phosphatidylinositol), PtdIns4P (Phosphatidylinositol 4- phosphate) and PtdIns(4,5)P2 (Phosphatidylinositol 4,5- bisphosphate) to generate phosphatidylinositol 3,4,5-trisphosphate (PIP3). PIP3 plays a key role by recruiting PH domain-containing proteins to the membrane, including AKT1 and PDPK1, activating signaling cascades involved in cell growth, survival, proliferation, motility and morphology. Participates in cellular signaling in response to various growth factors. Involved in the activation of AKT1 upon stimulation by receptor tyrosine kinases ligands such as EGF, insulin, IGF1, VEGFA and PDGF. Involved in signaling via insulin-receptor substrate (IRS) proteins. Essential in endothelial cell migration during vascular development through VEGFA signaling, possibly by regulating RhoA activity. Required for lymphatic vasculature development, possibly by binding to RAS and by activation by EGF and FGF2, but not by PDGF. Regulates invadopodia formation through the PDPK1-AKT1 pathway. Participates in cardiomyogenesis in embryonic stem cells through a AKT1 pathway. Participates in vasculogenesis in embryonic stem cells through PDK1 and protein kinase C pathway. Also has serine-protein kinase activity: phosphorylates PIK3R1 (p85alpha regulatory subunit), EIF4EBP1 and HRAS. Plays a role in the positive regulation of phagocytosis and pinocytosis (By similarity); Belongs to the PI3/PI4-kinase family.","label: attribute=""display name"" labelsize=12 labelAlignment=left outline=true outlineColor=white outlineTransparency=95 outlineWidth=10 background=false color=black dropShadow=false","","stringdb","protein","MPPRPSSGELWGIHLMPPRILVECLLPNGMIVTLECLREATLITIKHELFKEARKYPLHQLLQDESSYIFVSVTQEAEREEFFDETRRLCDLRLFQPFLKVIEPVGNREEKILNREIGFAIGMPVCEFDMVKDPEVQDFRRNILNVCKEAVDLRDLNSPHSRAMYVYPPNVESSPELPKHIYNKLDKGQIIVVIWVIVSPNNDKQKYTLKINHDCVPEQVIAEAIRKKTRSMLLSSEQLKLCVLEYQGKYILKVCGCDEYFLEKYPLSQYKYIRSCIMLGRMPNLMLMAKESLYSQLPMDCFTMPSYSRRISTATPYMNGETSTKSLWVINSALRIKILCATYVNVNIRDIDKIYVRTGIYHGGEPLCDNVNTQRVPCSNPRWNEWLNYDIYIPDLPRAARLCLSICSVKGRKGAKEEHCPLAWGNINLFDYTDTLVSGKMALNLWPVPHGLEDLLNPIGVTGSNPNKETPCLELEFDWFSSVVKFPDMSVIEEHANWSVSREAGFSYSHAGLSNRLARDNELRENDKEQLKAISTRDPLSEITEQEKDFLWSHRHYCVTIPEILPKLLLSVKWNSRDEVAQMYCLVKDWPPIKPEQAMELLDCNYPDPMVRGFAVRCLEKYLTDDKLSQYLIQLVQVLKYEQYLDNLLVRFLLKKALTNQRIGHFFFWHLKSEMHNKTVSQRFGLLLESYCRACGMYLKHLNRQVEAMEKLINLTDILKQEKKDETQKVQMKFLVEQMRRPDFMDALQGFLSPLNPAHQLGNLRLEECRIMSSAKRPLWLNWENPDIMSELLFQNNEIIFKNGDDLRQDMLTLQIIRIMENIWQNQGLDLRMLPYGCLSIGDCVGLIEVVRNSHTIMQIQCKGGLKGALQFNSHTLHQWLKDKNKGEIYDAAIDLFTRSCAGYCVATFILGIGDRHNSNIMVKDDGQLFHIDFGHFLDHKKKKFGYKRERVPFVLTQDFLIVISKGAQECTKTREFERFQEMCYKAYLAIRQHANLFINLFSMMLGSGMPELQSFDDIAYIRKTLALDKTEQEALEYFMKQMNDAHHGGWTTKMDWIFHTIKQHALN","Homo sapiens","2ENQ|2RD0|3HHM|3HIZ|3ZIM|4JPS|4L1B|4L23|4L2Y|4OVU|4OVV|4TUU|4TV3|4WAF|4YKN|4ZOP|5DXH|5DXT|5FI4|5ITD|5SW8|5SWG|5SWO|5SWP|5SWR|5SWT|5SX8|5SX9|5SXA|5SXB|5SXC|5SXD|5SXE|5SXF|5SXI|5SXJ|5SXK|5UBR|5UK8|5UKJ|5UL1|5XGH|5XGI|5XGJ|6NCT","Tclin","Kinase","2.243583","2.882937","1.712419","2.476735","1.956508","2.172669","2.739888","3.734753","3.139919","2.789634","4.829624","2.647769","4.153898","2.864275","2.534573","2.53709","2.493883","2.461417","2.732361","1.978089"
"stringdb:9606.ENSP00000358335",,"1.906534","4.83644","1.647417","4.343258","2.482801","0.978376","1.692488","1.831049","4.777823","1.172658","4.435508","MAP3K7",,"9606.ENSP00000358335","9606.ENSP00000358335","false","9606.ENSP00000358335",,"Q9NZ70","9606.ENSP00000358335","Transforming growth factor-beta-activated kinase 1; Serine/threonine kinase which acts as an essential component of the MAP kinase signal transduction pathway. Plays an important role in the cascades of cellular responses evoked by changes in the environment. Mediates signal transduction of TRAF6, various cytokines including interleukin-1 (IL-1), transforming growth factor-beta (TGFB), TGFB-related factors like BMP2 and BMP4, toll-like receptors (TLR), tumor necrosis factor receptor CD40 and B-cell receptor (BCR). Ceramides are also able to activate MAP3K7/TAK1. Once activated, acts as an upstream activator of the MKK/JNK signal transduction cascade and the p38 MAPK signal transduction cascade through the phosphorylation and activation of several MAP kinase kinases like MAP2K1/MEK1, MAP2K3/MKK3, MAP2K6/MKK6 and MAP2K7/MKK7. These MAP2Ks in turn activate p38 MAPKs, c-jun N-terminal kinases (JNKs) and I-kappa-B kinase complex (IKK). Both p38 MAPK and JNK pathways control the transcription factors activator protein-1 (AP-1), while nuclear factor-kappa B is activated by IKK. MAP3K7 activates also IKBKB and MAPK8/JNK1 in response to TRAF6 signaling and mediates BMP2- induced apoptosis. In osmotic stress signaling, plays a major role in the activation of MAPK8/JNK1, but not that of NF-kappa-B. Promotes TRIM5 capsid-specific restriction activity.","label: attribute=""display name"" labelsize=12 labelAlignment=left outline=true outlineColor=white outlineTransparency=95 outlineWidth=10 background=false color=black dropShadow=false","","stringdb","protein","MSTASAASSSSSSSAGEMIEAPSQVLNFEEIDYKEIEVEEVVGRGAFGVVCKAKWRAKDVAIKQIESESERKAFIVELRQLSRVNHPNIVKLYGACLNPVCLVMEYAEGGSLYNVLHGAEPLPYYTAAHAMSWCLQCSQGVAYLHSMQPKALIHRDLKPPNLLLVAGGTVLKICDFGTACDIQTHMTNNKGSAAWMAPEVFEGSNYSEKCDVFSWGIILWEVITRRKPFDEIGGPAFRIMWAVHNGTRPPLIKNLPKPIESLMTRCWSKDPSQRPSMEEIVKIMTHLMRYFPGADEPLQYPCQYSDEGQSNSATSTGSFMDIASTNTSNKSDTNMEQVPATNDTIKRLESKLLKNQAKQQSESGRLSLGASRGSSVESLPPTSEGKRMSADMSEIEARIAATTAYSKPKRGHRKTASFGNILDVPEIVISGNGQPRRRSIQDLTVTGTEPGQVSSRSSSPSVRMITTSGPTSEKPTRSHPWTPDDSTDTNGSDNSIPMAYLTLDHQLQPLAPCPNSKESMAVFEQHCKMAQEYMKVQTEIALLLQRKQELVAELDQDEKDQQNTSRLVQEHKKLLDENKSLSTYYQQCKKQLEVIRSQQQKRQGTS","Homo sapiens","","Tchem","Kinase","1.650399","4.497202","1.616147","2.104522","1.496847","1.033424","2.496365","2.436295","2.784485","4.477505","4.517372","2.45198","4.46753","1.803262","1.501589","2.340577","2.496254","2.023666","1.719012","1.030735"
"stringdb:9606.ENSP00000385958",,"1.866026","5.0","1.310293","0.877862","4.266297","1.030615","0.880526","2.134181","5.0",,"1.38386","RPS14",,"9606.ENSP00000385958","9606.ENSP00000385958","false","9606.ENSP00000385958",,"P62263","9606.ENSP00000385958","Small ribosomal subunit protein uS11; Ribosomal protein S14","label: attribute=""display name"" labelsize=12 labelAlignment=left outline=true outlineColor=white outlineTransparency=95 outlineWidth=10 background=false color=black dropShadow=false","","stringdb","protein","MAPRKGKEKKEEQVISLGPQVAEGENVFGVCHIFASFNDTFVHVTDLSGKETICRVTGGMKVKADRDESSPYAAMLAAQDVAQRCKELGITALHIKLRATGGNRTKTPGPGAQSALRALARSGMKIGRIEDVTPIPSDSTRRKGGRRGRRL","Homo sapiens","","Tbio","","2.495082","4.863232","3.565171","3.572781","4.269597","2.456265","3.430345","4.333744","3.442234","4.816414","4.670416","3.8757","4.727107","4.351976","2.730621","4.881384","3.107542","2.580088","2.587861","2.595717"
"stringdb:9606.ENSP00000472985",,"1.443995","5.0","1.112911","0.604484","4.345181","0.543776","0.699129","1.867119","4.413319","0.501818","1.603885","RPS5",,"9606.ENSP00000472985","9606.ENSP00000472985","false","9606.ENSP00000472985",,"P46782","9606.ENSP00000472985","Small ribosomal subunit protein uS7; Ribosomal protein S5; Belongs to the universal ribosomal protein uS7 family.","label: attribute=""display name"" labelsize=12 labelAlignment=left outline=true outlineColor=white outlineTransparency=95 outlineWidth=10 background=false color=black dropShadow=false","","stringdb","protein","MTEWETAAPAVAETPDIKLFGKWSTDDVQINDISLQDYIAVKEKYAKYLPHSAGRYAAKRFRKAQCPIVERLTNSMMMHGRNNGKKLMTVRIVKHAFEIIHLLTGENPLQVLVNAIINSGPREDSTRIGRAGTVRRQAVDVSPLRRVNQAIWLLCTGAREAAFRNIKTIAECLADELINAAKGSSNSYAIKKKDELERVAKSNR","Homo sapiens","","Tbio","","2.622575","4.695601","4.670768","2.923297","4.549581","2.326336","3.524302","4.919135","3.69238","4.866181","4.7502","4.148176","4.851234","4.491254","2.514548","4.698727","2.841359","3.676326","2.463096","2.493783"
"stringdb:9606.ENSP00000302896",,"1.594004","5.0","1.153566","0.687836","4.325253","0.801456","0.815399","1.768524","5.0","1.028269","1.376943","RPS9",,"9606.ENSP00000302896","9606.ENSP00000302896","false","9606.ENSP00000302896",,"P46781","9606.ENSP00000302896","Small ribosomal subunit protein uS4; Ribosomal protein S9","label: attribute=""display name"" labelsize=12 labelAlignment=left outline=true outlineColor=white outlineTransparency=95 outlineWidth=10 background=false color=black dropShadow=false","","stringdb","protein","MPVARSWVCRKTYVTPRRPFEKSRLDQELKLIGEYGLRNKREVWRVKFTLAKIRKAARELLTLDEKDPRRLFEGNALLRRLVRIGVLDEGKMKLDYILGLKIEDFLERRLQTQVFKLGLAKSIHHARVLIRQRHIRVRKQVVNIPSFIVRLDSQKHIDFSLRSPYGGGRPGRVKRKNAKKGQGGAGAGDDEEED","Homo sapiens","","Tbio","","2.777496","4.860457","3.301021","3.13536","4.629986","2.460597","3.237948","4.892399","3.313093","4.792089","4.834229","4.736465","4.967922","4.544421","3.049422","4.930359","3.199177","3.450995","2.813144","2.620622"
"stringdb:9606.ENSP00000385035",,"1.819625","1.811145","1.700679","1.24366","4.769775","1.192175","1.735446","1.556067","1.988193",,"2.588556","C1S",,"9606.ENSP00000385035","9606.ENSP00000385035","false","9606.ENSP00000385035",,"Q9UCV4","9606.ENSP00000385035","Complement component 1, s subcomponent; C1s B chain is a serine protease that combines with C1q and C1r to form C1, the first component of the classical pathway of the complement system. C1r activates C1s so that it can, in turn, activate C2 and C4.","label: attribute=""display name"" labelsize=12 labelAlignment=left outline=true outlineColor=white outlineTransparency=95 outlineWidth=10 background=false color=black dropShadow=false","","stringdb","protein","MWCIVLFSLLAWVYAEPTMYGEILSPNYPQAYPSEVEKSWDIEVPEGYGIHLYFTHLDIELSENCAYDSVQIISGDTEEGRLCGQRSSNNPHSPIVEEFQVPYNKLQVIFKSDFSNEERFTGFAAYYVATDINECTDFVDVPCSHFCNNFIGGYFCSCPPEYFLHDDMKNCGVNCSGDVFTALIGEIASPNYPKPYPENSRCEYQIRLEKGFQVVVTLRREDFDVEAADSAGNCLDSLVFVAGDRQFGPYCGHGFPGPLNIETKSNALDIIFQTDLTGQKKGWKLRYHGDPMPCPKEDTPNSVWEPAKAKYVFRDVVQITCLDGFEVVEGRVGATSFYSTCQSNGKWSNSKLKCQPVDCGIPESIENGKVEDPESTLFGSVIRYTCEEPYYYMENGGGGEYHCAGNGSWVNEVLGPELPKCVPVCGVPREPFEEKQRIIGGSDADIKNFPWQVFFDNPWAGGALINEYWVLTAAHVVEGNREPTMYVGSTSVQTSRLAKSKMLTPEHVFIHPGWKLLEVPEGRTNFDNDIALVRLKDPVKMGPTVSPICLPGTSSDYNLMDGDLGLISGWGRTEKRDRAVRLKAARLPVAPLRKCKEVKVEKPTADAEAYVFTPNMICAGGEKGMDSCKGDSGGAFAVQDPNDKTKFYAAGLVSWGPQCGTYGLYTRVKNYVDWIMKTMQENSTPRED","Homo sapiens","","Tchem","","2.483447","4.588842","1.82736","4.322691","2.858369","2.581381","3.466245","4.556539","3.135657","4.939886","4.623974","3.047951","4.930703","2.90097","2.331149","3.570621","4.515788","3.236061","2.132541","2.445708"
"stringdb:9606.ENSP00000472469",,"0.980033","5.0","4.204451",,"4.224303",,,"2.717182","4.402257",,"1.047331","RPS28",,"9606.ENSP00000472469","9606.ENSP00000472469","false","9606.ENSP00000472469",,"P62857","9606.ENSP00000472469","Small ribosomal subunit protein eS28; Ribosomal protein S28; Belongs to the eukaryotic ribosomal protein eS28 family.","label: attribute=""display name"" labelsize=12 labelAlignment=left outline=true outlineColor=white outlineTransparency=95 outlineWidth=10 background=false color=black dropShadow=false","","stringdb","protein","MDTSRVQPIKLARVTKVLGRTGSQGQCTQVRVEFMDDTSRSIIRNVKGPVREGDVLTLLESEREARRLR","Homo sapiens","","Tbio","","2.297104","3.023949","0.475876","2.658327","2.281828","0.7","3.538638","3.521996","2.983263","4.652892","2.421192","4.762751","4.413176","3.600105","2.166874","2.484839","2.442088","3.376246","2.410102","1.019808"
"stringdb:9606.ENSP00000336829",,"1.479788","1.365746","4.268971",,"5.0",,"1.205044","2.236199","1.51773","0.730553","4.37088","FGG",,"9606.ENSP00000336829","9606.ENSP00000336829","false","9606.ENSP00000336829",,"Q9UCF3","9606.ENSP00000336829","Fibrinogen gamma chain; Together with fibrinogen alpha (FGA) and fibrinogen beta (FGB), polymerizes to form an insoluble fibrin matrix. Has a major function in hemostasis as one of the primary components of blood clots. In addition, functions during the early stages of wound repair to stabilize the lesion and guide cell migration during re- epithelialization. Was originally thought to be essential for platelet aggregation, based on in vitro studies using anticoagulated blood. However, subsequent studies have shown that it is not absolutely required for thrombus formation in vivo. Enhances expression of SELP in activated platelets via an ITGB3- dependent pathway. Maternal fibrinogen is essential for successful pregnancy. Fibrin deposition is also associated with infection, where it protects against IFNG-mediated hemorrhage. May also facilitate the antibacterial immune response via both innate and T-cell mediated pathways; Endogenous ligands","label: attribute=""display name"" labelsize=12 labelAlignment=left outline=true outlineColor=white outlineTransparency=95 outlineWidth=10 background=false color=black dropShadow=false","","stringdb","protein","MSWSLHPRNLILYFYALLFLSSTCVAYVATRDNCCILDERFGSYCPTTCGIADFLSTYQTKVDKDLQSLEDILHQVENKTSEVKQLIKAIQLTYNPDESSKPNMIDAATLKSRKMLEEIMKYEASILTHDSSIRYLQEIYNSNNQKIVNLKEKVAQLEAQCQEPCKDTVQIHDITGKDCQDIANKGAKQSGLYFIKPLKANQQFLVYCEIDGSGNGWTVFQKRLDGSVDFKKNWIQYKEGFGHLSPTGTTEFWLGNEKIHLISTQSAIPYALRVELEDWNGRTSTADYAMFKVGPEADKYRLTYAYFAGGDAGDAFDGFDFGDDPSDKFFTSHNGMQFSTWDNDNDKFEGNCAEQDGSGWWMNKCHAGHLNGVYYQGGTYSKASTPNGYDNGIIWATWKTRWYSMKKTTMKIIPFNRLTIGEGQQHHLGGAKQVRPEHPAETEYDSLYPEDDL","Homo sapiens","","Tbio","","1.533333","4.717917","1.040433","4.193296","1.766355","1.293731","3.253214","2.420873","2.444942","4.998757","3.863769","4.695313","2.0783","2.136549","0.897693","1.026234","2.719784","1.143544","0.996704","1.6"
"stringdb:9606.ENSP00000388107",,"1.33638","4.530387","4.183295","4.186211","4.416817","0.839591","4.165938","4.264559","4.458473",,"4.210249","UBA52",,"9606.ENSP00000388107","9606.ENSP00000388107","false","9606.ENSP00000388107",,"Q9UPK7","9606.ENSP00000388107","Ubiquitin A-52 residue ribosomal protein fusion product 1; Ubiquitin: Exists either covalently attached to another protein, or free (unanchored). When covalently bound, it is conjugated to target proteins via an isopeptide bond either as a monomer (monoubiquitin), a polymer linked via different Lys residues of the ubiquitin (polyubiquitin chains) or a linear polymer linked via the initiator Met of the ubiquitin (linear polyubiquitin chains). Polyubiquitin chains, when attached to a target protein, have different functions depending on the Lys residue of the ubiquitin that is linked: Lys-6-linked may be involved in DNA repair; Lys-11-linked is involved in ERAD (endoplasmic reticulum-associated degradation) and in cell-cycle regulation; Lys-29-linked is involved in lysosomal degradation; Lys-33-linked is involved in kinase modification; Lys-48-linked is involved in protein degradation via the proteasome; Lys-63-linked is involved in endocytosis, DNA-damage responses as well as in signaling processes leading to activation of the transcription factor NF-kappa-B. Linear polymer chains formed via attachment by the initiator Met lead to cell signaling. Ubiquitin is usually conjugated to Lys residues of target proteins, however, in rare cases, conjugation to Cys or Ser residues has been observed. When polyubiquitin is free (unanchored-polyubiquitin), it also has distinct roles, such as in activation of protein kinases, and in signaling; In the C-terminal section; belongs to the eukaryotic ribosomal protein eL40 family.","label: attribute=""display name"" labelsize=12 labelAlignment=left outline=true outlineColor=white outlineTransparency=95 outlineWidth=10 background=false color=black dropShadow=false","","stringdb","protein","MQIFVKTLTGKTITLEVEPSDTIENVKAKIQDKEGIPPDQQRLIFAGKQLEDGRTLSDYNIQKESTLHLVLRLRGGIIEPSLRQLAQKYNCDKMICRKCYARLHPRAVNCRKKKCGHTNNLRPKKKVK","Homo sapiens","","Tbio","","4.458746","4.724108","2.137004","2.551369","2.094813","2.360593","3.134526","3.900419","3.198118","4.154658","4.329303","4.319067","4.604774","2.756806","2.436693","4.11739","2.447365","3.090614","2.288994","2.432542"
"stringdb:9606.ENSP00000306099",,"1.478867","1.461549","4.328004",,"5.0","0.990182","1.041805","1.64687","1.728053","0.700748","4.305363","FGB",,"9606.ENSP00000306099","9606.ENSP00000306099","false","9606.ENSP00000306099",,"P02675","9606.ENSP00000306099","Fibrinogen beta chain; Cleaved by the protease thrombin to yield monomers which, together with fibrinogen alpha (FGA) and fibrinogen gamma (FGG), polymerize to form an insoluble fibrin matrix. Fibrin has a major function in hemostasis as one of the primary components of blood clots. In addition, functions during the early stages of wound repair to stabilize the lesion and guide cell migration during re-epithelialization. Was originally thought to be essential for platelet aggregation, based on in vitro studies using anticoagulated blood. However subsequent studies have shown that it is not absolutely required for thrombus formation in vivo. Enhances expression of SELP in activated platelets. Maternal fibrinogen is essential for successful pregnancy. Fibrin deposition is also associated with infection, where it protects against IFNG-mediated hemorrhage. May also facilitate the antibacterial immune response via both innate and T-cell mediated pathways; Endogenous ligands","label: attribute=""display name"" labelsize=12 labelAlignment=left outline=true outlineColor=white outlineTransparency=95 outlineWidth=10 background=false color=black dropShadow=false","","stringdb","protein","MKRMVSWSFHKLKTMKHLLLLLLCVFLVKSQGVNDNEEGFFSARGHRPLDKKREEAPSLRPAPPPISGGGYRARPAKAAATQKKVERKAPDAGGCLHADPDLGVLCPTGCQLQEALLQQERPIRNSVDELNNNVEAVSQTSSSSFQYMYLLKDLWQKRQKQVKDNENVVNEYSSELEKHQLYIDETVNSNIPTNLRVLRSILENLRSKIQKLESDVSAQMEYCRTPCTVSCNIPVVSGKECEEIIRKGGETSEMYLIQPDSSVKPYRVYCDMNTENGGWTVIQNRQDGSVDFGRKWDPYKQGFGNVATNTDGKNYCGLPGEYWLGNDKISQLTRMGPTELLIEMEDWKGDKVKAHYGGFTVQNEANKYQISVNKYRGTAGNALMDGASQLMGENRTMTIHNGMFFSTYDRDNDGWLTSDPRKQCSKEDGGGWWYNRCHAANPNGRYYWGGQYTWDMAKHGTDDGVVWMNWKGSWYSMRKMSMKIRPFFPQQ","Homo sapiens","1FZA|1FZB|1FZC|1FZE|1FZF|1FZG|1LT9|1LTJ|1N86|1N8E|1RE3|1RE4|1RF0|1RF1|2A45|2FFD|2H43|2HLO|2HOD|2HPC|2OYH|2OYI|2Q9I|2XNX|2XNY|3BVH|3E1I|3GHG|3HUS|6ATZ","Tbio","","1.733333","4.87917","0.963016","4.171498","1.87609","2.3","3.153083","2.461535","2.852041","4.996741","2.388192","2.79219","2.118608","2.44119","0.978998","1.172859","2.784212","1.242062","1.126406","1.766667"
"stringdb:9606.ENSP00000289153",,"2.055134","4.542143","1.9536","1.717261","2.029418","1.632555","1.578964","2.118558","4.442477","0.95578","4.126566","PIK3CB",,"9606.ENSP00000289153","9606.ENSP00000289153","false","9606.ENSP00000289153",,"P42338","9606.ENSP00000289153","Phosphatidylinositol 4,5-bisphosphate 3-kinase 110 kDa catalytic subunit beta; Phosphoinositide-3-kinase (PI3K) that phosphorylates PtdIns (Phosphatidylinositol), PtdIns4P (Phosphatidylinositol 4- phosphate) and PtdIns(4,5)P2 (Phosphatidylinositol 4,5- bisphosphate) to generate phosphatidylinositol 3,4,5-trisphosphate (PIP3). PIP3 plays a key role by recruiting PH domain-containing proteins to the membrane, including AKT1 and PDPK1, activating signaling cascades involved in cell growth, survival, proliferation, motility and morphology. Involved in the activation of AKT1 upon stimulation by G-protein coupled receptors (GPCRs) ligands such as CXCL12, sphingosine 1-phosphate, and lysophosphatidic acid. May also act downstream receptor tyrosine kinases. Required in different signaling pathways for stable platelet adhesion and aggregation. Plays a role in platelet activation signaling triggered by GPCRs, alpha-IIb/beta-3 integrins (ITGA2B/ ITGB3) and ITAM (immunoreceptor tyrosine-based activation motif)-bearing receptors such as GP6. Regulates the strength of adhesion of ITGA2B/ ITGB3 activated receptors necessary for the cellular transmission of contractile forces. Required for platelet aggregation induced by F2 (thrombin) and thromboxane A2 (TXA2). Has a role in cell survival. May have a role in cell migration. Involved in the early stage of autophagosome formation. Modulates the intracellular level of PtdIns3P (Phosphatidylinositol 3-phosphate) and activates PIK3C3 kinase activity. May act as a scaffold, independently of its lipid kinase activity to positively regulate autophagy. May have a role in insulin signaling as scaffolding protein in which the lipid kinase activity is not required. May have a kinase-independent function in regulating cell proliferation and in clathrin-mediated endocytosis. Mediator of oncogenic signal in cell lines lacking PTEN. The lipid kinase activity is necessary for its role in oncogenic transformation. Required for the growth of ERBB2 and RAS driven tumors.","label: attribute=""display name"" labelsize=12 labelAlignment=left outline=true outlineColor=white outlineTransparency=95 outlineWidth=10 background=false color=black dropShadow=false","","stringdb","protein","MCFSFIMPPAMADILDIWAVDSQIASDGSIPVDFLLPTGIYIQLEVPREATISYIKQMLWKQVHNYPMFNLLMDIDSYMFACVNQTAVYEELEDETRRLCDVRPFLPVLKLVTRSCDPGEKLDSKIGVLIGKGLHEFDSLKDPEVNEFRRKMRKFSEEKILSLVGLSWMDWLKQTYPPEHEPSIPENLEDKLYGGKLIVAVHFENCQDVFSFQVSPNMNPIKVNELAIQKRLTIHGKEDEVSPYDYVLQVSGRVEYVFGDHPLIQFQYIRNCVMNRALPHFILVECCKIKKMYEQEMIAIEAAINRNSSNLPLPLPPKKTRIISHVWENNNPFQIVLVKGNKLNTEETVKVHVRAGLFHGTELLCKTIVSSEVSGKNDHIWNEPLEFDINICDLPRMARLCFAVYAVLDKVKTKKSTKTINPSKYQTIRKAGKVHYPVAWVNTMVFDFKGQLRTGDIILHSWSSFPDELEEMLNPMGTVQTNPYTENATALHVKFPENKKQPYYYPPFDKIIEKAAEIASSDSANVSSRGGKKFLPVLKEILDRDPLSQLCENEMDLIWTLRQDCREIFPQSLPKLLLSIKWNKLEDVAQLQALLQIWPKLPPREALELLDFNYPDQYVREYAVGCLRQMSDEELSQYLLQLVQVLKYEPFLDCALSRFLLERALGNRRIGQFLFWHLRSEVHIPAVSVQFGVILEAYCRGSVGHMKVLSKQVEALNKLKTLNSLIKLNAVKLNRAKGKEAMHTCLKQSAYREALSDLQSPLNPCVILSELYVEKCKYMDSKMKPLWLVYNNKVFGEDSVGVIFKNGDDLRQDMLTLQMLRLMDLLWKEAGLDLRMLPYGCLATGDRSGLIEVVSTSETIADIQLNSSNVAAAAAFNKDALLNWLKEYNSGDDLDRAIEEFTLSCAGYCVASYVLGIGDRHSDNIMVKKTGQLFHIDFGHILGNFKSKFGIKRERVPFILTYDFIHVIQQGKTGNTEKFGRFRQCCEDAYLILRRHGNLFITLFALMLTAGLPELTSVKDIQYLKDSLALGKSEEEALKQFKQKFDEALRESWTTKVNWMAHTVRKDYRS","Homo sapiens","","Tchem","Kinase","1.737125","2.601149","1.378386","2.312747","1.335753","0.973128","2.670568","2.524927","2.693373","2.582178","2.416681","2.678952","3.823375","2.25117","1.528082","2.328987","2.498991","1.96156","2.504513","1.041393"
"stringdb:9606.ENSP00000272317",,"1.785713","5.0","1.217986","4.225619","4.556375","0.835001","1.408258","4.339302","4.466452","1.063448","4.316393","RPS27A",,"9606.ENSP00000272317","9606.ENSP00000272317","false","9606.ENSP00000272317",,"Q9UPK7","9606.ENSP00000272317","Ubiquitin carboxyl extension protein 80; Ubiquitin: Exists either covalently attached to another protein, or free (unanchored). When covalently bound, it is conjugated to target proteins via an isopeptide bond either as a monomer (monoubiquitin), a polymer linked via different Lys residues of the ubiquitin (polyubiquitin chains) or a linear polymer linked via the initiator Met of the ubiquitin (linear polyubiquitin chains). Polyubiquitin chains, when attached to a target protein, have different functions depending on the Lys residue of the ubiquitin that is linked: Lys-6-linked may be involved in DNA repair; Lys-11-linked is involved in ERAD (endoplasmic reticulum-associated degradation) and in cell-cycle regulation; Lys-29-linked is involved in lysosomal degradation; Lys-33-linked is involved in kinase modification; Lys-48-linked is involved in protein degradation via the proteasome; Lys-63-linked is involved in endocytosis, DNA-damage responses as well as in signaling processes leading to activation of the transcription factor NF-kappa-B. Linear polymer chains formed via attachment by the initiator Met lead to cell signaling. Ubiquitin is usually conjugated to Lys residues of target proteins, however, in rare cases, conjugation to Cys or Ser residues has been observed. When polyubiquitin is free (unanchored-polyubiquitin), it also has distinct roles, such as in activation of protein kinases, and in signaling.","label: attribute=""display name"" labelsize=12 labelAlignment=left outline=true outlineColor=white outlineTransparency=95 outlineWidth=10 background=false color=black dropShadow=false","","stringdb","protein","MQIFVKTLTGKTITLEVEPSDTIENVKAKIQDKEGIPPDQQRLIFAGKQLEDGRTLSDYNIQKESTLHLVLRLRGGAKKRKKKSYTTPKKNKHKRKKVKLAVLKYYKVDENGKISRLRRECPSDECGAGVFMASHFDRHYCGKCCLTYCFNKPEDK","Homo sapiens","","Tbio","","2.570645","3.594962","3.142667","2.949524","3.851065","1.252044","3.367794","3.789159","3.449322","4.404507","4.12422","3.381535","4.765593","4.52807","2.574267","4.795956","3.070957","3.281922","2.62462","1.418301"
