"@id","adj.P.Val","compartment::cytoskeleton","compartment::cytosol","compartment::endoplasmic reticulum","compartment::endosome","compartment::extracellular","compartment::golgi apparatus","compartment::lysosome","compartment::mitochondrion","compartment::nucleus","compartment::peroxisome","compartment::plasma membrane","display name","logFC","name","query term","selected","shared name","Significance","stringdb::canonical name","stringdb::database identifier","stringdb::description","stringdb::enhancedLabel Passthrough","stringdb::full name","stringdb::namespace","stringdb::node type","stringdb::sequence","stringdb::species","stringdb::structures","target::development level","target::family","tissue::adrenal gland","tissue::blood","tissue::bone","tissue::bone marrow","tissue::eye","tissue::gall bladder","tissue::heart","tissue::intestine","tissue::kidney","tissue::liver","tissue::lung","tissue::muscle","tissue::nervous system","tissue::pancreas","tissue::saliva","tissue::skin","tissue::spleen","tissue::stomach","tissue::thyroid gland","tissue::urine"
"stringdb:9606.ENSP00000435096",,"1.09755","5.0","1.167471","0.661239","4.253857","0.505935",,"1.289556","5.0",,"0.935503","RPS25",,"9606.ENSP00000435096","9606.ENSP00000435096","false","9606.ENSP00000435096",,"P62851","9606.ENSP00000435096","Small ribosomal subunit protein eS25; Ribosomal protein S25","label: attribute=""display name"" labelsize=12 labelAlignment=left outline=true outlineColor=white outlineTransparency=95 outlineWidth=10 background=false color=black dropShadow=false","","stringdb","protein","MPPKDDKKKKDAGKSAKKDKDPVNKSGGKAKKKKWSKGKVRDKLNNLVLFDKATYDKLCKEVPNYKLITPAVVSERLKIRGSLARAALQELLSKGLIKLVSKHRAQVIYTRNTKGGDAPAAGEDA","Homo sapiens","","Tbio","","2.435313","4.597622","2.756806","2.741448","4.130456","2.277533","4.221082","3.783806","2.810979","4.34278","4.438728","4.567523","4.400154","4.616883","2.430827","4.848346","2.774285","2.667566","2.369958","2.366859"
"stringdb:9606.ENSP00000452909",,"1.19066","4.701694","1.183628","0.536952","4.255514","0.542443","1.066637","2.791354","1.592776","1.171875","0.90617","RPL28",,"9606.ENSP00000452909","9606.ENSP00000452909","false","9606.ENSP00000452909",,"P46779","9606.ENSP00000452909","Large ribosomal subunit protein eL28; Component of the large ribosomal subunit; Belongs to the eukaryotic ribosomal protein eL28 family.","label: attribute=""display name"" labelsize=12 labelAlignment=left outline=true outlineColor=white outlineTransparency=95 outlineWidth=10 background=false color=black dropShadow=false","","stringdb","protein","MSAHLQWMVVRNCSSFLIKRNKQTYSTEPNNLKARNSFRYNGLIHRKTVGVEPAADGKGVVVVIKRRSGQRKPATSYVRTTINKNARATLSSIRHMIRKNKYRPDLRMDMLASTGSGLCCSVAVQPWASSSTSLCLRTLICNMRVDRPYYSGLMRRLNVQNLLDCAHKS","Homo sapiens","","Tbio","","2.355388","3.989612","2.453869","2.878381","3.867464","2.436693","2.981875","4.921899","4.611661","3.914364","4.272137","3.534261","4.956748","4.390722","2.641099","4.528252","2.673512","3.008942","2.410046","2.559587"
"stringdb:9606.ENSP00000435370",,"1.21044","5.0","1.206084","0.817836","5.0","0.929263","1.007939","1.185764","4.71627","0.805861","1.227843","FAU",,"9606.ENSP00000435370","9606.ENSP00000435370","false","9606.ENSP00000435370",,"P35544","9606.ENSP00000435370","Finkel-Biskis-Reilly murine sarcoma virus (FBR-MuSV) ubiquitously expressed; FAU, ubiquitin like and ribosomal protein S30 fusion","label: attribute=""display name"" labelsize=12 labelAlignment=left outline=true outlineColor=white outlineTransparency=95 outlineWidth=10 background=false color=black dropShadow=false","","stringdb","protein","MQLFVRAQELHTFEVTGQETVAQIKAHVASLEGIAPEDQVVLLAGAPLEDEATLGQCGVEALTTLEVAGRMLGGKVHGSLARAGKVRGQTPKVAKQEKKKKKTGRAKRRMQYNRRFVNVVPTFGKKKGPNANS","Homo sapiens","2L7R","Tbio","","2.356281","3.220177","1.392527","2.805481","3.069106","2.264975","3.65778","4.651185","3.392958","3.702571","4.387833","3.58472","4.618652","2.426065","2.347915","2.986855","2.877748","2.609004","2.288249","2.340973"
"stringdb:9606.ENSP00000225430",,"1.857355","5.0","1.613065","0.869581","1.920295","1.230933","1.135174","2.047292","4.629601","0.665219","1.735479","RPL19",,"9606.ENSP00000225430","9606.ENSP00000225430","false","9606.ENSP00000225430",,"P84098","9606.ENSP00000225430","Large ribosomal subunit protein eL19; Ribosomal protein L19; Belongs to the eukaryotic ribosomal protein eL19 family.","label: attribute=""display name"" labelsize=12 labelAlignment=left outline=true outlineColor=white outlineTransparency=95 outlineWidth=10 background=false color=black dropShadow=false","","stringdb","protein","MSMLRLQKRLASSVLRCGKKKVWLDPNETNEIANANSRQQIRKLIKDGLIIRKPVTVHSRARCRKNTLARRKGRHMGIGKRKGTANARMPEKVTWMRRMRILRRLLRRYRESKKIDRHMYHSLYLKVKGNVFKNKRILMEHIHKLKADKARKKLLADQAEARRSKTKEARKRREERLQAKKEEIIKTLSKEEETKK","Homo sapiens","5A2Q","Tbio","","2.948777","4.75636","3.21958","3.112376","3.955281","2.427594","3.530386","4.853284","3.797594","4.8931","4.459211","4.851428","4.967848","4.037841","2.958072","4.191828","3.277034","3.559685","2.935047","2.533518"
"stringdb:9606.ENSP00000377640",,"1.176836","5.0","4.261722",,"4.183654",,,"1.588877","1.608166",,"0.743164","RPL24",,"9606.ENSP00000377640","9606.ENSP00000377640","false","9606.ENSP00000377640",,"P83731","9606.ENSP00000377640","Large ribosomal subunit protein eL24; Ribosomal protein L24; Belongs to the eukaryotic ribosomal protein eL24 family.","label: attribute=""display name"" labelsize=12 labelAlignment=left outline=true outlineColor=white outlineTransparency=95 outlineWidth=10 background=false color=black dropShadow=false","","stringdb","protein","MKVELCSFSGYKIYPGHGRRYARTDGKVFQFLNAKCESAFLSKRNPRQINWTVLYRRKHKKGQSEEIQKKRTRRAVKFQRAITGASLADIMAKRNQKPEVRKAQREQAIRAAKEAKKAKQASKKTAMAAAKAPTKAAPKQKIVKPVKVSAPRVGGKR","Homo sapiens","","Tbio","","2.012626","4.558319","2.599668","2.210944","2.979362","1.495082","2.820253","4.58978","2.702831","4.629716","3.933706","3.390121","4.141389","3.789166","2.089198","2.973615","2.67879","2.600611","2.275657","1.607812"
"stringdb:9606.ENSP00000274242",,"0.894564","4.382217","0.644522",,"1.194104",,"0.806624","1.215826","2.563224",,"0.71544","RPL37",,"9606.ENSP00000274242","9606.ENSP00000274242","false","9606.ENSP00000274242",,"P61927","9606.ENSP00000274242","Large ribosomal subunit protein eL37; Binds to the 23S rRNA; L ribosomal proteins","label: attribute=""display name"" labelsize=12 labelAlignment=left outline=true outlineColor=white outlineTransparency=95 outlineWidth=10 background=false color=black dropShadow=false","","stringdb","protein","MTKGTSSFGKRRNKTHTLCRRCGSKAYHLQKSTCGKCGYPAKRKRKYNWSAKAKRRNTTGTGRMRHLKIVYRRFRHGFREGTTPKPKRAAVAASSSS","Homo sapiens","","Tbio","","2.417859","4.869615","3.18652","2.613771","2.653786","2.186203","4.000366","4.82015","3.320067","4.345177","4.867791","4.806514","4.758327","3.028634","2.929599","3.589922","2.8586","3.802917","2.242417","2.313727"
"stringdb:9606.ENSP00000363079",,"1.852718","1.942885","1.698548","1.697272","4.812324","1.461822","1.853596","1.671436","2.002979","0.791645","2.545253","MBL2",,"9606.ENSP00000363079","9606.ENSP00000363079","false","9606.ENSP00000363079",,"Q96TF9","9606.ENSP00000363079","Mannose-binding lectin (protein C) 2, soluble; Calcium-dependent lectin involved in innate immune defense. Binds mannose, fucose and N-acetylglucosamine on different microorganisms and activates the lectin complement pathway. Binds to late apoptotic cells, as well as to apoptotic blebs and to necrotic cells, but not to early apoptotic cells, facilitating their uptake by macrophages. May bind DNA; Collectins","label: attribute=""display name"" labelsize=12 labelAlignment=left outline=true outlineColor=white outlineTransparency=95 outlineWidth=10 background=false color=black dropShadow=false","","stringdb","protein","MSLFPSLPLLLLSMVAASYSETVTCEDAQKTCPAVIACSSPGINGFPGKDGRDGTKGEKGEPGQGLRGLQGPPGKLGPPGNPGPSGSPGPKGQKGDPGKSPDGDSSLAASERKALQTEMARIKKWLTFSLGKQVGNKFFLTNGEIMTFEKVKALCVKFQASVATPRNAAENGAIQNLIKEEAFLGITDEKTEGQFVDLTGNRLTYTNWNEGEPNNAGSDEDCVLLLKNGQWNDVPCSTSHLAVCEFPI","Homo sapiens","","Tbio","","0.910193","3.132305","1.17054","4.396979","2.030441","0.204002","2.329795","2.070114","2.377212","4.723861","2.129902","1.893157","2.32029","1.361147","1.414974","1.593324","2.62549","1.49398","1.423494","1.568243"
"stringdb:9606.ENSP00000346067",,"2.161644","5.0","1.404555","1.38087","4.4681","1.084119","1.203023","1.708529","5.0",,"5.0","RPSA",,"9606.ENSP00000346067","9606.ENSP00000346067","false","9606.ENSP00000346067",,"P08865","9606.ENSP00000346067","Multidrug resistance-associated protein MGr1-Ag; Required for the assembly and/or stability of the 40S ribosomal subunit. Required for the processing of the 20S rRNA- precursor to mature 18S rRNA in a late step of the maturation of 40S ribosomal subunits. Also functions as a cell surface receptor for laminin. Plays a role in cell adhesion to the basement membrane and in the consequent activation of signaling transduction pathways. May play a role in cell fate determination and tissue morphogenesis. Acts as a PPP1R16B-dependent substrate of PPP1CA.","label: attribute=""display name"" labelsize=12 labelAlignment=left outline=true outlineColor=white outlineTransparency=95 outlineWidth=10 background=false color=black dropShadow=false","","stringdb","protein","MSGALDVLQMKEEDVLKFLAAGTHLGGTNLDFQMEQYIYKRKSDGIYIINLKRTWEKLLLAARAIVAIENPADVSVISSRNTGQRAVLKFAAATGATPIAGRFTPGTFTNQIQAAFREPRLLVVTDPRADHQPLTEASYVNLPTIALCNTDSPLRYVDIAIPCNNKGAHSVGLMWWMLAREVLRMRGTISREHPWEVMPDLYFYRDPEEIEKEEQAAAEKAVTKEEFQGEWTAPAPEFTATQPEVADWSEGVQVPSVPIQQFPTEDWSAQPATEDWSAAPTAQATEWVGATTDWS","Homo sapiens","","Tbio","","2.405609","4.872394","4.685024","2.765457","4.877656","1.764923","3.519379","4.869536","4.551436","4.960409","4.98619","4.597199","4.980683","4.803374","1.966611","4.843683","2.928096","4.552804","2.347316","1.968794"
"stringdb:9606.ENSP00000470972",,"1.439933","5.0","1.250296",,"4.304193",,"0.866337","2.084544","5.0",,"1.247721","RPS19",,"9606.ENSP00000470972","9606.ENSP00000470972","false","9606.ENSP00000470972",,"P39019","9606.ENSP00000470972","Small ribosomal subunit protein eS19; Required for pre-rRNA processing and maturation of 40S ribosomal subunits; Belongs to the eukaryotic ribosomal protein eS19 family.","label: attribute=""display name"" labelsize=12 labelAlignment=left outline=true outlineColor=white outlineTransparency=95 outlineWidth=10 background=false color=black dropShadow=false","","stringdb","protein","MPGVTVKDVNQQEFVRALAAFLKKSGKLKVPEWVDTVKLAKHKELAPYDENWFYTRAASTARHLYLRGGAGVGSMTKIYGGRQRNGVMPSHFSRGSKSVARRVLQALEGLKMVEKDQDGGRKLTPQGQRDLDRIAGQVAAANKKH","Homo sapiens","","Tbio","","2.996582","4.784669","2.058279","3.687849","4.635259","2.603577","4.072368","4.950396","4.533691","4.569072","4.49393","4.046253","4.799853","3.748314","2.846296","4.116657","3.301037","2.990441","2.865821","2.741624"
"stringdb:9606.ENSP00000265371",,"2.307007","4.383011","2.77658","3.861314","4.542502","1.489665","1.802809","4.201254","2.286007","0.375","4.799039","NRP1",,"9606.ENSP00000265371","9606.ENSP00000265371","false","9606.ENSP00000265371",,"O14786","9606.ENSP00000265371","Vascular endothelial cell growth factor 165 receptor; The membrane-bound isoform 1 is a receptor involved in the development of the cardiovascular system, in angiogenesis, in the formation of certain neuronal circuits and in organogenesis outside the nervous system. It mediates the chemorepulsant activity of semaphorins. It binds to semaphorin 3A, The PLGF-2 isoform of PGF, The VEGF165 isoform of VEGFA and VEGFB. Coexpression with KDR results in increased VEGF165 binding to KDR as well as increased chemotaxis. Regulate VEGF-induced angiogenesis. Binding to VEGFA initiates a signaling pathway needed for motor neuron axon guidance and cell body migration, including for the caudal migration of facial motor neurons from rhombomere 4 to rhombomere 6 during embryonic development (By similarity); CD molecules","label: attribute=""display name"" labelsize=12 labelAlignment=left outline=true outlineColor=white outlineTransparency=95 outlineWidth=10 background=false color=black dropShadow=false","","stringdb","protein","MERGLPLLCAVLALVLAPAGAFRNDKCGDTIKIESPGYLTSPGYPHSYHPSEKCEWLIQAPDPYQRIMINFNPHFDLEDRDCKYDYVEVFDGENENGHFRGKFCGKIAPPPVVSSGPFLFIKFVSDYETHGAGFSIRYEIFKRGPECSQNYTTPSGVIKSPGFPEKYPNSLECTYIVFVPKMSEIILEFESFDLEPDSNPPGGMFCRYDRLEIWDGFPDVGPHIGRYCGQKTPGRIRSSSGILSMVFYTDSAIAKEGFSANYSVLQSSVSEDFKCMEALGMESGEIHSDQITASSQYSTNWSAERSRLNYPENGWTPGEDSYREWIQVDLGLLRFVTAVGTQGAISKETKKKYYVKTYKIDVSSNGEDWITIKEGNKPVLFQGNTNPTDVVVAVFPKPLITRFVRIKPATWETGISMRFEVYGCKITDYPCSGMLGMVSGLISDSQITSSNQGDRNWMPENIRLVTSRSGWALPPAPHSYINEWLQIDLGEEKIVRGIIIQGGKHRENKVFMRKFKIGYSNNGSDWKMIMDDSKRKAKSFEGNNNYDTPELRTFPALSTRFIRIYPERATHGGLGLRMELLGCEVEAPTAGPTTPNGNLVDECDDDQANCHSGTGDDFQLTGGTTVLATEKPTVIDSTIQSEFPTYGFNCEFGWGSHKTFCHWEHDNHVQLKWSVLTSKTGPIQDHTGDGNFIYSQADENQKGKVARLVSPVVYSQNSAHCMTFWYHMSGSHVGTLRVKLRYQKPEEYDQLVWMAIGHQGDHWKEGRVLLHKSLKLYQVIFEGEIGKGNLGGIAVDDISINNHISQEDCAKPADLDKKNPEIKIDETGSTPGYEGEGEGDKNISRKPGNVLKTLDPILITIIAMSALGVLLGAVCGVVLYCACWHNGMSERNLSALENYNFELVDGVKLKKDKLNTQSTYSEA","Homo sapiens","","Tchem","","2.235346","2.67891","2.234879","4.462868","2.341211","1.518514","3.312467","2.710478","4.646258","4.549755","3.290025","4.589594","4.330338","2.340762","1.588616","2.368507","3.206045","1.907263","2.08728","1.364238"
"stringdb:9606.ENSP00000363676",,"1.398033","5.0","1.171915",,"4.270481","0.620321","0.912335","1.881502","5.0","0.640587","1.140351","RPL11",,"9606.ENSP00000363676","9606.ENSP00000363676","false","9606.ENSP00000363676",,"P62913","9606.ENSP00000363676","Large ribosomal subunit protein uL5; Component of the ribosome, a large ribonucleoprotein complex responsible for the synthesis of proteins in the cell. The small ribosomal subunit (SSU) binds messenger RNAs (mRNAs) and translates the encoded message by selecting cognate aminoacyl- transfer RNA (tRNA) molecules. The large subunit (LSU) contains the ribosomal catalytic site termed the peptidyl transferase center (PTC), which catalyzes the formation of peptide bonds, thereby polymerizing the amino acids delivered by tRNAs into a polypeptide chain. The nascent polypeptides leave the ribosome through a tunnel in the LSU and interact with protein factors that function in enzymatic processing, targeting, and the membrane insertion of nascent chains at the exit of the ribosomal tunnel. As part of the 5S RNP/5S ribonucleoprotein particle it is an essential component of the LSU, required for its formation and the maturation of rRNAs. It also couples ribosome biogenesis to p53/TP53 activation. As part of the 5S RNP it accumulates in the nucleoplasm and inhibits MDM2, when ribosome biogenesis is perturbed, mediating the stabilization and the activation of TP53. Promotes nucleolar location of PML (By similarity).","label: attribute=""display name"" labelsize=12 labelAlignment=left outline=true outlineColor=white outlineTransparency=95 outlineWidth=10 background=false color=black dropShadow=false","","stringdb","protein","MAQDQGEKENPMRELRIRKLCLNICVGESGDRLTRAAKVLEQLTGQTPVFSKARYTVRSFGIRRNEKIAVHCTVRGAKAEEILEKGLKVREYELRKNNFSDTGNFGFGIQEHIDLGIKYDPSIGIYGLDFYVVLGRPGFSIADKKRRTGCIGAKHRISKEEAMRWFQQKYDGIILPGK","Homo sapiens","4XXB","Tbio","","2.757801","4.791095","3.800659","3.571608","4.087164","2.785377","3.452314","4.301698","3.855492","4.896348","4.401496","3.52783","4.702308","4.396342","2.91824","4.160928","3.200105","3.218447","2.798835","2.867114"
"stringdb:9606.ENSP00000346027",,"1.182069","4.614563","3.327823",,"1.149323","0.854039","0.560693","2.01009","3.232862","0.810188","0.966091","RPL21",,"9606.ENSP00000346027","9606.ENSP00000346027","false","9606.ENSP00000346027",,"P46778","9606.ENSP00000346027","Large ribosomal subunit protein eL21; Component of the large ribosomal subunit.","label: attribute=""display name"" labelsize=12 labelAlignment=left outline=true outlineColor=white outlineTransparency=95 outlineWidth=10 background=false color=black dropShadow=false","","stringdb","protein","MTNTKGKRRGTRYMFSRPFRKHGVVPLATYMRIYKKGDIVDIKGMGTVQKGMPHKCYHGKTGRVYNVTQHAVGIVVNKQVKGKILAKRINVRIEHIKHSKSRDSFLKRVKENDQKKKEAKEKGTWVQLKRQPAPPREAHFVRTNGKEPELLEPIPYEFMA","Homo sapiens","","Tbio","","1.298125","3.833548","3.171085","1.575957","4.334714","1.090909","3.494315","4.838436","2.909847","4.60316","4.350805","4.843667","4.911677","4.899076","1.154323","4.133344","1.651501","3.538508","1.033424","1.090909"
"stringdb:9606.ENSP00000433623",,"2.361995","4.698728","2.222165","4.52355","2.829743","1.62592","2.496544","3.402239","5.0","1.650288","5.0","TRAF6",,"9606.ENSP00000433623","9606.ENSP00000433623","false","9606.ENSP00000433623",,"Q9Y4K3","9606.ENSP00000433623","TNF receptor-associated factor 6, E3 ubiquitin protein ligase; E3 ubiquitin ligase that, together with UBE2N and UBE2V1, mediates the synthesis of 'Lys-63'-linked-polyubiquitin chains conjugated to proteins, such as IKBKG, IRAK1, AKT1 and AKT2. Also mediates ubiquitination of free/unanchored polyubiquitin chain that leads to MAP3K7 activation. Leads to the activation of NF-kappa-B and JUN. May be essential for the formation of functional osteoclasts. Seems to also play a role in dendritic cells (DCs) maturation and/or activation. Represses c- Myb-mediated transactivation, in B-lymphocytes. Adapter protein that seems to play a role in signal transduction initiated via TNF receptor, IL-1 receptor and IL-17 receptor. Regulates osteoclast differentiation by mediating the activation of adapter protein complex 1 (AP-1) and NF-kappa-B, in response to RANK-L stimulation. Together with MAP3K8, mediates CD40 signals that activate ERK in B-cells and macrophages, and thus may play a role in the regulation of immunoglobulin production; Ring finger proteins","label: attribute=""display name"" labelsize=12 labelAlignment=left outline=true outlineColor=white outlineTransparency=95 outlineWidth=10 background=false color=black dropShadow=false","","stringdb","protein","MSLLNCENSCGSSQSESDCCVAMASSCSAVTKDDSVGGTASTGNLSSSFMEEIQGYDVEFDPPLESKYECPICLMALREAVQTPCGHRFCKACIIKSIRDAGHKCPVDNEILLENQLFPDNFAKREILSLMVKCPNEGCLHKMELRHLEDHQAHCEFALMDCPQCQRPFQKFHINIHILKDCPRRQVSCDNCAASMAFEDKEIHDQNCPLANVICEYCNTILIREQMPNHYDLDCPTAPIPCTFSTFGCHEKMQRNHLARHLQENTQSHMRMLAQAVHSLSVIPDSGYISEVRNFQETIHQLEGRLVRQDHQIRELTAKMETQSMYVSELKRTIRTLEDKVAEIEAQQCNGIYIWKIGNFGMHLKCQEEEKPVVIHSPGFYTGKPGYKLCMRLHLQLPTAQRCANYISLFVHTMQGEYDSHLPWPFQGTIRLTILDQSEAPVRQNHEEIMDAKPELLAFQRPTIPRNPKGFGYVTFMHLEALRQRTFIKDDTLLVRCEVSTRFDMGSLRREGFQPRSTDAGV","Homo sapiens","1LB4|1LB5|1LB6|2ECI|2JMD|3HCS|3HCT|3HCU|4Z8M|5ZUJ|6A33","Tbio","","1.732024","3.027552","2.469409","2.784137","1.905496","0.687501","2.626824","2.52802","2.728991","2.636501","2.488659","2.488619","2.697264","1.984623","1.640199","2.248277","2.969105","2.053238","1.849838","1.179842"
"stringdb:9606.ENSP00000263025",,"5.0","5.0","4.545361","5.0","3.444744","5.0","2.610205","5.0","4.827081","2.006143","4.672497","MAPK3",,"9606.ENSP00000263025","9606.ENSP00000263025","false","9606.ENSP00000263025",,"P27361","9606.ENSP00000263025","Extracellular signal-regulated kinase 1; Serine/threonine kinase which acts as an essential component of the MAP kinase signal transduction pathway. MAPK1/ERK2 and MAPK3/ERK1 are the 2 MAPKs which play an important role in the MAPK/ERK cascade. They participate also in a signaling cascade initiated by activated KIT and KITLG/SCF. Depending on the cellular context, the MAPK/ERK cascade mediates diverse biological functions such as cell growth, adhesion, survival and differentiation through the regulation of transcription, translation, cytoskeletal rearrangements. The MAPK/ERK cascade plays also a role in initiation and regulation of meiosis, mitosis, and postmitotic functions in differentiated cells by phosphorylating a number of transcription factors. About 160 substrates have already been discovered for ERKs. Many of these substrates are localized in the nucleus, and seem to participate in the regulation of transcription upon stimulation. However, other substrates are found in the cytosol as well as in other cellular organelles, and those are responsible for processes such as translation, mitosis and apoptosis. Moreover, the MAPK/ERK cascade is also involved in the regulation of the endosomal dynamics, including lysosome processing and endosome cycling through the perinuclear recycling compartment (PNRC); as well as in the fragmentation of the Golgi apparatus during mitosis. The substrates include transcription factors (such as ATF2, BCL6, ELK1, ERF, FOS, HSF4 or SPZ1), cytoskeletal elements (such as CANX, CTTN, GJA1, MAP2, MAPT, PXN, SORBS3 or STMN1), regulators of apoptosis (such as BAD, BTG2, CASP9, DAPK1, IER3, MCL1 or PPARG), regulators of translation (such as EIF4EBP1) and a variety of other signaling-related molecules (like ARHGEF2, FRS2 or GRB10). Protein kinases (such as RAF1, RPS6KA1/RSK1, RPS6KA3/RSK2, RPS6KA2/RSK3, RPS6KA6/RSK4, SYK, MKNK1/MNK1, MKNK2/MNK2, RPS6KA5/MSK1, RPS6KA4/MSK2, MAPKAPK3 or MAPKAPK5) and phosphatases (such as DUSP1, DUSP4, DUSP6 or DUSP16) are other substrates which enable the propagation the MAPK/ERK signal to additional cytosolic and nuclear targets, thereby extending the specificity of the cascade.","label: attribute=""display name"" labelsize=12 labelAlignment=left outline=true outlineColor=white outlineTransparency=95 outlineWidth=10 background=false color=black dropShadow=false","","stringdb","protein","MAAAAAQGGGGGEPRRTEGVGPGVPGEVEMVKGQPFDVGPRYTQLQYIGEGAYGMVSSAYDHVRKTRVAIKKISPFEHQTYCQRTLREIQILLRFRHENVIGIRDILRASTLEAMRDVYIVQDLMETDLYKLLKSQQLSNDHICYFLYQILRGLKYIHSANVLHRDLKPSNLLINTTCDLKICDFGLARIADPEHDHTGFLTEYVATRWYRAPEIMLNSKGYTKSIDIWSVGCILAEMLSNRPIFPGKHYLDQLNHILGILGSPSQEDLNCIINMKARNYLQSLPSKTKVAWAKLFPKSDSKALDLLDRMLTFNPNKRITVEEALAHPYLEQYYDPTDEPVAEEPFTFAMELDDLPKERLKELIFQETARFQPGVLEAP","Homo sapiens","2ZOQ|4QTB|6GES","Tchem","Kinase","3.205716","3.296444","2.597365","3.162503","3.917726","2.665503","3.59387","3.426534","3.422587","3.141159","3.503672","3.579891","4.672361","3.019254","2.630114","3.319205","3.201796","3.218123","3.071875","2.425797"
"stringdb:9606.ENSP00000428085",,"1.393389","5.0","1.403838",,"4.271397","0.568814","0.578","2.241925","5.0","0.635108","1.259416","RPL30",,"9606.ENSP00000428085","9606.ENSP00000428085","false","9606.ENSP00000428085",,"P62888","9606.ENSP00000428085","Large ribosomal subunit protein eL30; Ribosomal protein L30; Belongs to the eukaryotic ribosomal protein eL30 family.","label: attribute=""display name"" labelsize=12 labelAlignment=left outline=true outlineColor=white outlineTransparency=95 outlineWidth=10 background=false color=black dropShadow=false","","stringdb","protein","MVAAKKTKKSLESINSRLQLVMKSGKYVLGYKQTLKMIRQGKAKLVILANNCPALRKSEIEYYAMLAKTGVHHYSGNNIELGTACGKYYRVCTLAIIDPGDSDIIRSMPEQTGEK","Homo sapiens","3VI6","Tbio","","2.769869","4.680567","3.139929","3.264867","4.134361","2.729435","3.445139","4.006173","3.208447","4.817957","3.677344","4.222004","4.353417","3.387145","2.891537","3.725797","3.384485","2.98571","3.114256","2.839771"
"stringdb:9606.ENSP00000278572",,"5.0","5.0","4.289421","0.77049","4.284086","1.226947","0.971717","5.0","5.0","0.53514","5.0","RPS3",,"9606.ENSP00000278572","9606.ENSP00000278572","false","9606.ENSP00000278572",,"P23396","9606.ENSP00000278572","Small ribosomal subunit protein uS3; Involved in translation as a component of the 40S small ribosomal subunit. Has endonuclease activity and plays a role in repair of damaged DNA. Cleaves phosphodiester bonds of DNAs containing altered bases with broad specificity and cleaves supercoiled DNA more efficiently than relaxed DNA. Displays high binding affinity for 7,8-dihydro-8-oxoguanine (8-oxoG), a common DNA lesion caused by reactive oxygen species (ROS). Has also been shown to bind with similar affinity to intact and damaged DNA. Stimulates the N-glycosylase activity of the base excision protein OGG1. Enhances the uracil excision activity of UNG1. Also stimulates the cleavage of the phosphodiester backbone by APEX1. When located in the mitochondrion, reduces cellular ROS levels and mitochondrial DNA damage. Has also been shown to negatively regulate DNA repair in cells exposed to hydrogen peroxide. Plays a role in regulating transcription as part of the NF-kappa-B p65-p50 complex where it binds to the RELA/p65 subunit, enhances binding of the complex to DNA and promotes transcription of target genes. Represses its own translation by binding to its cognate mRNA. Binds to and protects TP53/p53 from MDM2-mediated ubiquitination. Involved in spindle formation and chromosome movement during mitosis by regulating microtubule polymerization. Involved in induction of apoptosis through its role in activation of CASP8. Induces neuronal apoptosis by interacting with the E2F1 transcription factor and acting synergistically with it to up-regulate pro-apoptotic proteins BCL2L11/BIM and HRK/Dp5. Interacts with TRADD following exposure to UV radiation and induces apoptosis by caspase-dependent JNK activation.","label: attribute=""display name"" labelsize=12 labelAlignment=left outline=true outlineColor=white outlineTransparency=95 outlineWidth=10 background=false color=black dropShadow=false","","stringdb","protein","MAVQISKKRKFVADGIFKAELNEFLTRELAEDGYSGVEVRVTPTRTEIIILATRTQNVLGEKGRRIRELTAVVQKRFGFPEGSVELKIMVMVTGYPLLPLKLYAEKVATRGLCAIAQAESLRYKLLGGLAVRRACYGVLRFIMESGAKGCEVVVSGKLRGQRAKSMKFVDGLMIHSGDPVNYYVDTAVRHVLLRQGVLGIKVKIMLPWDPTGKIGPKKPLPDHVSIVEPKDEILPTTPISEQKGGKPEPPAMPQPVPTA","Homo sapiens","1WH9","Tbio","","4.472622","4.945673","3.920072","3.000186","4.85015","2.478663","3.127702","4.850983","4.459879","4.956879","4.932664","4.522742","4.98398","4.881812","3.00094","4.990569","2.915632","4.457057","2.50965","2.627844"
